category,headline,url
ENVIRONMENT,One of world's top urban forests threatened by tiny beetle,http://www.foxnews.com/world/2018/08/16/one-worlds-top-urban-forests-threatened-by-tiny-beetle.html
ENVIRONMENT,"Endangered Green, Loggerhead turtles make comeback in Cyprus",http://www.foxnews.com/world/2018/08/16/endangered-green-loggerhead-turtles-make-comeback-in-cyprus.html
ENVIRONMENT,Mexico: Lopez Obrador expands plan for Yucatan tourist train,http://www.foxnews.com/world/2018/08/14/mexico-lopez-obrador-expands-plan-for-yucatan-tourist-train.html
MAMMALS,"Orca that carried dead, decomposing calf for weeks now returns to fun with friends",http://www.foxnews.com/science/2018/08/12/orca-that-carried-dead-decomposing-calf-for-weeks-now-returns-to-fun-with-friends.html
AUSTRALIA,"Hundreds of thirsty cows in drought-stricken Australia swarm water truck, video shows",http://www.foxnews.com/world/2018/08/10/hundreds-thirsty-cows-in-drought-stricken-australia-swarm-water-truck-video-shows.html
ENVIRONMENT,The Latest: Northern Europe prepares for summer storms,http://www.foxnews.com/world/2018/08/10/latest-northern-europe-prepares-for-summer-storms.html
ENVIRONMENT,"Firefighter's wife, baby among 93 victims of Greece blaze",http://www.foxnews.com/world/2018/08/09/firefighters-wife-baby-among-93-victims-greece-blaze.html
ENVIRONMENT,"Boys rescued from cave, once stateless, get Thai citizenship",http://www.foxnews.com/world/2018/08/08/boys-rescued-from-cave-once-stateless-get-thai-citizenship.html
ENVIRONMENT,Photo exhibit documents revival of Polish Jewish life,http://www.foxnews.com/world/2018/08/08/photo-exhibit-documents-revival-polish-jewish-life.html
ENVIRONMENT,"In quake-hit Indonesia, a challenge to recover the dead",http://www.foxnews.com/world/2018/08/07/in-quake-hit-indonesia-challenge-to-recover-dead.html
ENVIRONMENT,Greece's PM promises full investigation of deadly fire,http://www.foxnews.com/world/2018/08/07/greeces-pm-promises-full-investigation-deadly-fire.html
ENVIRONMENT,The Latest: More car limits in France as heat wave peaks,http://www.foxnews.com/world/2018/08/07/latest-more-car-limits-in-france-as-heat-wave-peaks.html
ENVIRONMENT,Man saved from quake-flattened mosque on Indonesia island,http://www.foxnews.com/world/2018/08/07/man-saved-from-quake-flattened-mosque-on-indonesia-island.html
ENVIRONMENT,2 tropical storms storms gaining force off Mexico's coast,http://www.foxnews.com/world/2018/08/06/2-tropical-storms-storms-gaining-force-off-mexicos-coast.html
ENVIRONMENT,Portugal battles major wildfire as Europe heat wave endures,http://www.foxnews.com/world/2018/08/06/portugal-battles-major-wildfire-as-europe-heat-wave-endures.html
ENVIRONMENT,"Red alerts for Portugal, Spain amid smothering heat wave",http://www.foxnews.com/world/2018/08/04/red-alerts-for-portugal-spain-amid-smothering-heat-wave.html
ENVIRONMENT,Thailand's rescued cave boys end stay at Buddhist temple,http://www.foxnews.com/world/2018/08/04/thailands-rescued-cave-boys-end-stay-at-buddhist-temple.html
ENVIRONMENT,The Latest: Another Greek fire victim dies of her injuries,http://www.foxnews.com/world/2018/08/03/latest-another-greek-fire-victim-dies-her-injuries.html
ENVIRONMENT,Greece to tear down illegal fences for better fire safety,http://www.foxnews.com/world/2018/08/03/greece-to-tear-down-illegal-fences-for-better-fire-safety.html
OCEANS,Whale shark unwrapped from fishing line by Hawaii family,http://www.foxnews.com/us/2018/08/02/whale-shark-unwrapped-from-fishing-line-by-hawaii-family.html
ENVIRONMENT,The Latest: EU speeds up funds for farmers amid drought,http://www.foxnews.com/world/2018/08/02/latest-eu-speeds-up-funds-for-farmers-amid-drought.html
ENVIRONMENT,"Hot African air brings scorching heat, dust to Europe",http://www.foxnews.com/world/2018/08/02/hot-african-air-brings-scorching-heat-dust-to-europe.html
ENVIRONMENT,Water crisis salts the earth in Iraq's long-neglected south,http://www.foxnews.com/world/2018/08/02/water-crisis-salts-earth-in-iraqs-long-neglected-south.html
ENVIRONMENT,Storms force swimmer to suspend attempt to cross Pacific,http://www.foxnews.com/world/2018/08/01/storms-force-swimmer-to-suspend-attempt-to-cross-pacific.html
ENVIRONMENT,"A makeover for milkweed, for the sake of butterflies",http://www.foxnews.com/world/2018/07/31/makeover-for-milkweed-for-sake-butterflies.html
ENVIRONMENT,Bodies of 70 killed in deadly Greek wildfires identified,http://www.foxnews.com/world/2018/07/31/bodies-70-killed-in-deadly-greek-wildfires-identified.html
ENVIRONMENT,Greece: Divers recover body offshore of where wildfire raged,http://www.foxnews.com/world/2018/07/30/greece-divers-recover-body-offshore-where-wildfire-raged.html
ENVIRONMENT,TASTE OF THE TOUR: Pan-seared squid in the Basque Country,http://www.foxnews.com/world/2018/07/27/taste-tour-pan-seared-squid-in-basque-country.html
OCEANS,Florida beaches littered with dead sea turtles; scientists blame red tide,http://www.foxnews.com/science/2018/07/26/florida-beaches-littered-with-dead-sea-turtles-scientists-blame-red-tide.html
ENVIRONMENT,Algae blooms force Poland to shut down 50 Baltic Sea beaches,http://www.foxnews.com/world/2018/07/26/algae-blooms-force-poland-to-shut-down-50-baltic-sea-beaches.html
ENVIRONMENT,10th endangered rhino dies in Kenya after botched transfer,http://www.foxnews.com/world/2018/07/26/10th-endangered-rhino-dies-in-kenya-after-botched-transfer.html
ENVIRONMENT,The Latest: Belgium confirms Belgian tourist died in fire,http://www.foxnews.com/world/2018/07/26/latest-belgium-confirms-belgian-tourist-died-in-fire.html
ENVIRONMENT,Frantic relatives search for missing in Athens' morgue,http://www.foxnews.com/world/2018/07/26/frantic-relatives-search-for-missing-in-athens-morgue.html
ENVIRONMENT,"TASTE OF THE TOUR: Henri IV, Poule au Pot and pressed cheese",http://www.foxnews.com/world/2018/07/25/taste-tour-henri-iv-poule-au-pot-and-pressed-cheese.html
ENVIRONMENT,The Latest: Macedonia: Probe begun of anti-Greek hate speech,http://www.foxnews.com/world/2018/07/25/latest-macedonia-probe-begun-anti-greek-hate-speech.html
ENVIRONMENT,"Fisherman: 'Chaos' as kids, elderly escaped Greek fire",http://www.foxnews.com/world/2018/07/25/fisherman-chaos-as-kids-elderly-escaped-greek-fire.html
LEGISLATION,California city OKs jail time for defying plastic straw ban,http://www.foxnews.com/politics/2018/07/25/california-city-oks-jail-time-for-defying-plastic-straw-ban.html
ENVIRONMENT,Boys rescued from Thai cave ordained at Buddhist temple,http://www.foxnews.com/world/2018/07/25/boys-rescued-from-thai-cave-ordained-at-buddhist-temple.html
ENVIRONMENT,Rescue crews search for missing in Greek wildfires,http://www.foxnews.com/world/2018/07/25/rescue-crews-search-for-missing-in-greek-wildfires.html
ENVIRONMENT,"Greek forest fire survivor tells of dramatic flight, rescue",http://www.foxnews.com/world/2018/07/24/greek-forest-fire-survivor-tells-dramatic-flight-rescue.html
ENVIRONMENT,The Latest: Spain sends 2 water carriers to help fight fires,http://www.foxnews.com/world/2018/07/24/latest-spain-sends-2-water-carriers-to-help-fight-fires.html
ENVIRONMENT,Thailand's soccer boys prepare to ordain as Buddhist novices,http://www.foxnews.com/world/2018/07/24/thailands-soccer-boys-prepare-to-ordain-as-buddhist-novices.html
ENVIRONMENT,Death toll set to rise in Greek seaside wildfires,http://www.foxnews.com/world/2018/07/24/death-toll-set-to-rise-in-greek-seaside-wildfires.html
ENVIRONMENT,9 Australians awarded bravery medals for Thai cave rescue,http://www.foxnews.com/world/2018/07/24/9-australians-awarded-bravery-medals-for-thai-cave-rescue.html
ENVIRONMENT,The Latest: Greece declares emergency due to 2 wildfires,http://www.foxnews.com/world/2018/07/23/latest-greece-declares-emergency-due-to-2-wildfires.html
ENVIRONMENT,Residents flee forest fire near Greek capital of Athens,http://www.foxnews.com/world/2018/07/23/residents-flee-forest-fire-near-greek-capital-athens.html
ENVIRONMENT,Africa sees 1st carbon-neutral brewery amid climate concerns,http://www.foxnews.com/world/2018/07/21/africa-sees-1st-carbon-neutral-brewery-amid-climate-concerns.html
ENVIRONMENT,Human Rights Watch urges Brazil to regulate pesticides more,http://www.foxnews.com/world/2018/07/20/human-rights-watch-urges-brazil-to-regulate-pesticides-more.html
ENVIRONMENT,Thailand seeks control over movies about cave ordeal,http://www.foxnews.com/world/2018/07/20/thailand-seeks-control-over-movies-about-cave-ordeal.html
ENVIRONMENT,Rights groups urges Myanmar to make amends for seized land,http://www.foxnews.com/world/2018/07/17/rights-groups-urges-myanmar-to-make-amends-for-seized-land.html
ENVIRONMENT,UN envoy: 1.1 billion people face risks from lack of cooling,http://www.foxnews.com/world/2018/07/16/un-envoy-1-1-billion-people-face-risks-from-lack-cooling.html
ASIA,"Thailand cave rescue boys thank rescuers, admit they are craving pork, rice and KFC",http://www.foxnews.com/world/2018/07/14/thailand-cave-rescue-boys-thank-rescuers-admit-are-craving-pork-rice-and-kfc.html
ENVIRONMENT,"10,000 protest Trump in Edinburgh; UK police seek paraglider",http://www.foxnews.com/world/2018/07/14/10000-protest-trump-in-edinburgh-uk-police-seek-paraglider.html
ENVIRONMENT,7 endangered rhinos die in Kenya relocation bid: Official,http://www.foxnews.com/world/2018/07/13/7-endangered-rhinos-die-in-kenya-relocation-bid-official.html
AFRICA,"8 endangered black rhinos found dead in Kenya, officials say it's 'a complete disaster'",http://www.foxnews.com/world/2018/07/13/8-endangered-black-rhinos-found-dead-in-kenya-officials-say-its-complete-disaster.html
ENVIRONMENT,"Boys meant to stay 1 hour in cave, but outside, rains began",http://www.foxnews.com/world/2018/07/13/boys-meant-to-stay-1-hour-in-cave-but-outside-rains-began.html
ENVIRONMENT,"Mission accomplished and boys healthy, rescuers head home",http://www.foxnews.com/world/2018/07/12/mission-accomplished-and-boys-healthy-rescuers-head-home.html
ENVIRONMENT,African woman tells UN that climate change is security risk,http://www.foxnews.com/world/2018/07/11/african-woman-tells-un-that-climate-change-is-security-risk.html
ENVIRONMENT,Rescued Thai boys make victory signs from hospital beds,http://www.foxnews.com/world/2018/07/11/rescued-thai-boys-make-victory-signs-from-hospital-beds.html
ENVIRONMENT,"NATO allies offer trainers, seek to set disputes aside",http://www.foxnews.com/world/2018/07/11/nato-allies-offer-trainers-seek-to-set-disputes-aside.html
ENVIRONMENT,AP Interview: US rescuer details high-risk Thai cave mission,http://www.foxnews.com/world/2018/07/11/ap-interview-us-rescuer-details-high-risk-thai-cave-mission.html
ENVIRONMENT,Coffee and conservation: Mozambique tries both on a mountain,http://www.foxnews.com/world/2018/07/11/coffee-and-conservation-mozambique-tries-both-on-mountain.html
ENVIRONMENT,The Latest: Thai PM thanks people involved in cave rescue,http://www.foxnews.com/world/2018/07/11/latest-thai-pm-thanks-people-involved-in-cave-rescue.html
ENVIRONMENT,Rescued Thai soccer team unable to attend World Cup final,http://www.foxnews.com/world/2018/07/10/rescued-thai-soccer-team-unable-to-attend-world-cup-final.html
ENVIRONMENT,Australian rangers trap big crocodile near tourist gorge,http://www.foxnews.com/world/2018/07/10/australian-rangers-trap-big-crocodile-near-tourist-gorge.html
ENVIRONMENT,"3rd mission underway at Thai cave, aims to rescue all left",http://www.foxnews.com/world/2018/07/10/3rd-mission-underway-at-thai-cave-aims-to-rescue-all-left.html
ENVIRONMENT,"Rescuers prepare to move rest of boys, coach from Thai cave",http://www.foxnews.com/world/2018/07/09/rescuers-prepare-to-move-rest-boys-coach-from-thai-cave.html
ENVIRONMENT,Thai officials clear media as cave rescue seems imminent,http://www.foxnews.com/world/2018/07/07/thai-officials-clear-media-as-cave-rescue-seems-imminent.html
ENVIRONMENT,Woman says Trudeau apologized after encounter in 2000,http://www.foxnews.com/world/2018/07/07/woman-says-trudeau-apologized-after-encounter-in-2000.html
ENVIRONMENT,"Backed by Prince Harry, conservation group expands in Africa",http://www.foxnews.com/world/2018/07/07/backed-by-prince-harry-conservation-group-expands-in-africa.html
ENVIRONMENT,The Latest: Rescuer says conditions good for extraction,http://www.foxnews.com/world/2018/07/07/latest-rescuer-says-conditions-good-for-extraction.html
ENVIRONMENT,Thai coach apologizes to parents as boys write they're OK,http://www.foxnews.com/world/2018/07/07/thai-coach-apologizes-to-parents-as-boys-write-theyre-ok.html
WORLD,Three social media stars die after falling 100 feet over waterfall while hiking: police,http://www.foxnews.com/world/2018/07/06/three-social-media-stars-die-after-falling-100-feet-over-waterfall-while-hiking-police.html
ENVIRONMENT,The Latest: FIFA invites trapped Thai boys to World Cup,http://www.foxnews.com/world/2018/07/06/latest-fifa-invites-trapped-thai-boys-to-world-cup.html
ENVIRONMENT,The Latest: Thai authorities say boat death toll at 10,http://www.foxnews.com/world/2018/07/06/latest-thai-authorities-say-boat-death-toll-at-10.html
ENVIRONMENT,Thai rescuer in cave dies from lack of oxygen,http://www.foxnews.com/world/2018/07/06/thai-rescuer-in-cave-dies-from-lack-oxygen.html
ENVIRONMENT,Polish environment minister: Too many species are protected,http://www.foxnews.com/world/2018/07/05/polish-environment-minister-too-many-species-are-protected.html
ENVIRONMENT,The Latest: Japan's World Cup team sends boys good luck wish,http://www.foxnews.com/world/2018/07/05/latest-japans-world-cup-team-sends-boys-good-luck-wish.html
ENVIRONMENT,Iraq bans farming summer crops as water crisis grows dire,http://www.foxnews.com/world/2018/07/05/iraq-bans-farming-summer-crops-as-water-crisis-grows-dire.html
ENVIRONMENT,Rescuers race to drain water inside Thai cave before rains,http://www.foxnews.com/world/2018/07/04/rescuers-race-to-drain-water-inside-thai-cave-before-rains.html
ENVIRONMENT,Archaeologists urge Albania to protect underwater heritage,http://www.foxnews.com/world/2018/07/04/archaeologists-urge-albania-to-protect-underwater-heritage.html
ENVIRONMENT,The Latest: Thais work to install internet in flooded cave,http://www.foxnews.com/world/2018/07/04/latest-thais-work-to-install-internet-in-flooded-cave.html
ENVIRONMENT,Soccer players speaking from Thai cave say they are healthy,http://www.foxnews.com/world/2018/07/03/soccer-players-speaking-from-thai-cave-say-are-healthy.html
ENVIRONMENT,Greenpeace activists crash Superman-shaped drone into French nuclear plant,http://www.foxnews.com/world/2018/07/03/greenpeace-activists-crash-superman-shaped-drone-into-french-nuclear-plant.html
ENVIRONMENT,British divers bring experience to Thai cave drama,http://www.foxnews.com/world/2018/07/03/british-divers-bring-experience-to-thai-cave-drama.html
ENVIRONMENT,The Latest: Thai SEALs looking after trapped boys in cave,http://www.foxnews.com/world/2018/07/03/latest-thai-seals-looking-after-trapped-boys-in-cave.html
ENVIRONMENT,Thai official says cave boys may have to dive despite danger,http://www.foxnews.com/world/2018/07/03/thai-official-says-cave-boys-may-have-to-dive-despite-danger.html
ENVIRONMENT,"AP Explains: Getting soccer team out of Thai cave, carefully",http://www.foxnews.com/world/2018/07/03/ap-explains-getting-soccer-team-out-thai-cave-carefully.html
ENVIRONMENT,"AP PHOTOS: Green grass, black lava at Guatemala golf club",http://www.foxnews.com/world/2018/07/03/ap-photos-green-grass-black-lava-at-guatemala-golf-club.html
ENVIRONMENT,"Bali volcano hurls lava and ash, airport unaffected",http://www.foxnews.com/world/2018/07/02/bali-volcano-hurls-lava-and-ash-airport-unaffected.html
ENVIRONMENT,The Latest: Expert: Many challenges ahead for Thai rescuers,http://www.foxnews.com/world/2018/07/02/latest-expert-many-challenges-ahead-for-thai-rescuers.html
ENVIRONMENT,Divers with extra supplies advance in Thai cave passageway,http://www.foxnews.com/world/2018/07/02/divers-with-extra-supplies-advance-in-thai-cave-passageway.html
ENVIRONMENT,Thai divers make little progress in murky cave search,http://www.foxnews.com/world/2018/07/01/thai-divers-make-little-progress-in-murky-cave-search.html
ENVIRONMENT,"In song and prayer, Thais show solidarity with missing boys",http://www.foxnews.com/world/2018/06/29/in-song-and-prayer-thais-show-solidarity-with-missing-boys.html
ENVIRONMENT,Water reaches near entrance of Thai cave where 13 missing,http://www.foxnews.com/world/2018/06/28/water-reaches-near-entrance-thai-cave-where-13-missing.html
ENVIRONMENT,"Ethiopia, Eritrea leaders to meet 'soon' in surprising thaw",http://www.foxnews.com/world/2018/06/28/ethiopia-eritrea-leaders-to-meet-soon-in-surprising-thaw.html
ENVIRONMENT,"In split Cyprus, a homecoming digs up old conflicts",http://www.foxnews.com/world/2018/06/27/in-split-cyprus-homecoming-digs-up-old-conflicts.html
ENVIRONMENT,Tropical forests see high loss of tree cover for 2nd year,http://www.foxnews.com/world/2018/06/27/tropical-forests-see-high-loss-tree-cover-for-2nd-year.html
ENVIRONMENT,"Rain, high water complicate cave search for Thai soccer team",http://www.foxnews.com/world/2018/06/27/rain-high-water-complicate-cave-search-for-thai-soccer-team.html
ENVIRONMENT,Top Thai official says flooding complicates cave rescue,http://www.foxnews.com/world/2018/06/26/top-thai-official-says-flooding-complicates-cave-rescue.html
ENVIRONMENT,Power line put in Thai cave to help search for missing boys,http://www.foxnews.com/world/2018/06/25/power-line-put-in-thai-cave-to-help-search-for-missing-boys.html
ENVIRONMENT,"Walk or die: Algeria abandons 13,000 migrants in the Sahara",http://www.foxnews.com/world/2018/06/25/walk-or-die-algeria-abandons-13000-migrants-in-sahara.html
ENVIRONMENT,African wild dogs make comeback at Mozambican wildlife park,http://www.foxnews.com/world/2018/06/22/african-wild-dogs-make-comeback-at-mozambican-wildlife-park.html
ENVIRONMENT,NATO head: No guarantee trans-Atlantic alliance will survive,http://www.foxnews.com/world/2018/06/21/nato-head-no-guarantee-trans-atlantic-alliance-will-survive.html
ENVIRONMENT,"Thanks to China, over 100 million metric tons of plastic waste will soon have nowhere to go",http://www.foxnews.com/science/2018/06/21/thanks-to-china-over-100-million-metric-tons-plastic-waste-will-soon-have-nowhere-to-go.html
ENVIRONMENT,Hundreds pray at Indonesia lake as search for bodies resumes,http://www.foxnews.com/world/2018/06/21/hundreds-pray-at-indonesia-lake-as-search-for-bodies-resumes.html
ENVIRONMENT,Soccer amid ruins: World Cup inspires unusual fields in Peru,http://www.foxnews.com/world/2018/06/20/soccer-amid-ruins-world-cup-inspires-unusual-fields-in-peru.html
ENVIRONMENT,Giant crackdown against wildlife crime in 92 countries,http://www.foxnews.com/world/2018/06/20/giant-crackdown-against-wildlife-crime-in-92-countries.html
ENVIRONMENT,"Burning kites from Gaza damage Israeli farms, wildlife",http://www.foxnews.com/world/2018/06/20/burning-kites-from-gaza-damage-israeli-farms-wildlife.html
ENVIRONMENT,Police say 3 Polish men drown in southwest Germany,http://www.foxnews.com/world/2018/06/18/police-say-3-polish-men-drown-in-southwest-germany.html
ENVIRONMENT,Israel strikes Hamas targets in bid to deter burning kites,http://www.foxnews.com/world/2018/06/18/israel-strikes-hamas-targets-in-bid-to-deter-burning-kites.html
ENVIRONMENT,Carlotta weakens to tropical depression off Mexico's coast,http://www.foxnews.com/world/2018/06/18/carlotta-weakens-to-tropical-depression-off-mexicos-coast.html
ENVIRONMENT,Guatemala ends search for people buried by volcano eruption,http://www.foxnews.com/world/2018/06/17/guatemala-ends-search-for-people-buried-by-volcano-eruption.html
ENVIRONMENT,Tropical Storm Carlotta nears Mexican coast by Acapulco,http://www.foxnews.com/world/2018/06/17/tropical-storm-carlotta-nears-mexican-coast-by-acapulco.html
ENVIRONMENT,"In South Africa, plans for a refuge for pangolins in peril",http://www.foxnews.com/world/2018/06/16/in-south-africa-plans-for-refuge-for-pangolins-in-peril.html
ENVIRONMENT,Rains from Tropical Storm Carlotta pound Mexico's coast,http://www.foxnews.com/world/2018/06/16/rains-from-tropical-storm-carlotta-pound-mexicos-coast.html
ENVIRONMENT,New Delhi orders construction halt as pollution levels soar,http://www.foxnews.com/world/2018/06/15/new-delhi-orders-construction-halt-as-pollution-levels-soar.html
ENVIRONMENT,Tropical Storm Bud lashes Mexico's Los Cabos with winds,http://www.foxnews.com/world/2018/06/15/tropical-storm-bud-lashes-mexicos-los-cabos-with-winds.html
ENVIRONMENT,How Germany is turning wasteland into vast lakeside resorts,http://www.foxnews.com/world/2018/06/14/how-germany-is-turning-wasteland-into-vast-lakeside-resorts.html
ENVIRONMENT,Tropical Storm Bud heads for resorts at Baja's southern end,http://www.foxnews.com/world/2018/06/14/tropical-storm-bud-heads-for-resorts-at-bajas-southern-end.html
NEVADA,"Nevada wildfire caused by campers igniting excrement, sheriff says",http://www.foxnews.com/us/2018/06/13/nevada-wildfire-caused-by-campers-igniting-excrement-sheriff-says.html
ENVIRONMENT,AP PHOTOS: Traces of life trapped beneath volcano's ash,http://www.foxnews.com/world/2018/06/13/ap-photos-traces-life-trapped-beneath-volcanos-ash.html
ENVIRONMENT,Guatemala resumes search for victims of volcano eruption,http://www.foxnews.com/world/2018/06/13/guatemala-resumes-search-for-victims-volcano-eruption.html
ENVIRONMENT,"2 convicted in Germany for giant swastika on roof, fined",http://www.foxnews.com/world/2018/06/13/2-convicted-in-germany-for-giant-swastika-on-roof-fined.html
ENVIRONMENT,Hurricane Bud weakens to Category 1 on path to Baja resorts,http://www.foxnews.com/world/2018/06/13/hurricane-bud-weakens-to-category-1-on-path-to-baja-resorts.html
ENVIRONMENT,World Cup has divisive legacy for Russia's environment,http://www.foxnews.com/world/2018/06/12/world-cup-has-divisive-legacy-for-russias-environment.html
ENVIRONMENT,Hurricane Bud expected to weaken as it heads for Baja,http://www.foxnews.com/world/2018/06/12/hurricane-bud-expected-to-weaken-as-it-heads-for-baja.html
ENVIRONMENT,The Latest: Category 3 Hurricane Bud heads north off Mexico,http://www.foxnews.com/world/2018/06/11/latest-category-3-hurricane-bud-heads-north-off-mexico.html
ENVIRONMENT,Animal charities to open European circus elephant sanctuary,http://www.foxnews.com/world/2018/06/11/animal-charities-to-open-european-circus-elephant-sanctuary.html
ENVIRONMENT,AP PHOTOS: Long-dead critters animate Israel's nature museum,http://www.foxnews.com/world/2018/06/11/ap-photos-long-dead-critters-animate-israels-nature-museum.html
ENVIRONMENT,Recent developments surrounding the South China Sea,http://www.foxnews.com/world/2018/06/11/recent-developments-surrounding-south-china-sea.html
ENVIRONMENT,Hurricane Bud heading north off Mexico's Pacific coast,http://www.foxnews.com/world/2018/06/11/hurricane-bud-heading-north-off-mexicos-pacific-coast.html
ENVIRONMENT,Tropical Storm Bud grows off Mexico's Pacific coast,http://www.foxnews.com/world/2018/06/10/tropical-storm-bud-grows-off-mexicos-pacific-coast.html
ENVIRONMENT,Guatemala's Volcano of Fire emits another hot sediment flow,http://www.foxnews.com/world/2018/06/09/guatemalas-volcano-fire-emits-another-hot-sediment-flow.html
ENVIRONMENT,The Latest: New evacuations at Guatemala's Volcano of Fire,http://www.foxnews.com/world/2018/06/08/latest-new-evacuations-at-guatemalas-volcano-fire.html
ENVIRONMENT,Cleaning the seabed: Divers halt the carnage of 'ghost' nets,http://www.foxnews.com/world/2018/06/08/cleaning-seabed-divers-halt-carnage-ghost-nets.html
ENVIRONMENT,Guatemala town destroyed by volcano thought it was safe,http://www.foxnews.com/world/2018/06/08/guatemala-town-destroyed-by-volcano-thought-it-was-safe.html
ENVIRONMENT,"At Guatemala volcano, families left on own to keep searching",http://www.foxnews.com/world/2018/06/08/at-guatemala-volcano-families-left-on-own-to-keep-searching.html
ENVIRONMENT,Before-and-after images show Guatemala volcano's devastation,http://www.foxnews.com/world/2018/06/07/before-and-after-images-show-guatemala-volcanos-devastation.html
ENVIRONMENT,The Latest: Guatemala suspends volcano rescue effort,http://www.foxnews.com/world/2018/06/07/latest-guatemala-suspends-volcano-rescue-effort.html
ENVIRONMENT,Rare lynx found in Spain after being released in Portugal,http://www.foxnews.com/world/2018/06/07/rare-lynx-found-in-spain-after-being-released-in-portugal.html
ENVIRONMENT,"Scientists, animal activists: Don't cull Romanian brown bear",http://www.foxnews.com/world/2018/06/07/scientists-animal-activists-dont-cull-romanian-brown-bear.html
ENVIRONMENT,Wreckage seen 2 days after plane carrying 10 lost in Kenya,http://www.foxnews.com/world/2018/06/07/wreckage-seen-2-days-after-plane-carrying-10-lost-in-kenya.html
ENVIRONMENT,"At Guatemala volcano, weather and danger hinder search",http://www.foxnews.com/world/2018/06/07/at-guatemala-volcano-weather-and-danger-hinder-search.html
ENVIRONMENT,The Latest: Guatemala ponders renewing volcano victim hunt,http://www.foxnews.com/world/2018/06/06/latest-guatemala-ponders-renewing-volcano-victim-hunt.html
ENVIRONMENT,Season's 1st tropical storm forms in eastern Pacific,http://www.foxnews.com/world/2018/06/06/seasons-1st-tropical-storm-forms-in-eastern-pacific.html
ENVIRONMENT,New evacuations near Guatemala volcano set off panic,http://www.foxnews.com/world/2018/06/06/new-evacuations-near-guatemala-volcano-set-off-panic.html
ENVIRONMENT,Forecasters say hurricane to form off Mexico's Pacific coast,http://www.foxnews.com/world/2018/06/05/forecasters-say-hurricane-to-form-off-mexicos-pacific-coast.html
ASIA,Sherpa feared dead on Mount Everest following ASKfm's cryptocurrency publicity stunt,http://www.foxnews.com/world/2018/06/05/sherpa-feared-dead-on-mount-everest-following-askfms-cryptocurrency-publicity-stunt.html
