category,headline,url
ENVIRONMENT,"2 teen campers, pilot killed in plane crash in Switzerland",http://www.foxnews.com/world/2017/08/04/2-teen-campers-pilot-killed-in-plane-crash-in-switzerland.html
ENVIRONMENT,The Latest: Neighbors help Macedonia fight wildfires,http://www.foxnews.com/world/2017/08/04/latest-neighbors-help-macedonia-fight-wildfires.html
ENVIRONMENT,French mainland sends help to fight Corsica forest fire,http://www.foxnews.com/world/2017/08/04/french-mainland-sends-help-to-fight-corsica-forest-fire.html
ENVIRONMENT,"Sea dispute, N. Korea, Muslim militants top ASEAN meetings",http://www.foxnews.com/world/2017/08/04/sea-dispute-n-korea-muslim-militants-top-asean-meetings.html
ENVIRONMENT,"Instructor, trainee quizzed after Portugal beach plane crash",http://www.foxnews.com/world/2017/08/03/instructor-trainee-quizzed-after-portugal-beach-plane-crash.html
ENVIRONMENT,119 dolphins died this year on Romania's Black Sea coast,http://www.foxnews.com/world/2017/08/03/119-dolphins-died-this-year-on-romanias-black-sea-coast.html
ENVIRONMENT,"Small plane crash-lands on packed Portuguese beach, kills 2",http://www.foxnews.com/world/2017/08/02/reports-small-plane-crashes-on-portugal-beach-killing-2.html
ENVIRONMENT,Study: Being outside could become deadly in South Asia,http://www.foxnews.com/world/2017/08/02/study-being-outside-could-become-deadly-in-south-asia.html
ENVIRONMENT,German hiker missing since 1987 found in Swiss glacier,http://www.foxnews.com/world/2017/08/02/german-hiker-missing-since-1987-found-in-swiss-glacier.html
ENVIRONMENT,EU warns Poland to stop defying ban on forest logging,http://www.foxnews.com/world/2017/08/02/eu-warns-poland-to-stop-defying-ban-on-forest-logging.html
ENVIRONMENT,New eruption at Indonesia volcano spreads ash for miles,http://www.foxnews.com/world/2017/08/02/new-eruption-at-indonesia-volcano-spreads-ash-for-miles.html
ENVIRONMENT,"Wrecks, sunken treasures lie under Albania's coastal waters",http://www.foxnews.com/world/2017/08/02/wrecks-sunken-treasures-lie-under-albanias-coastal-waters.html
ENVIRONMENT,"Malaysia seizes ivory, pangolin scales from Africa",http://www.foxnews.com/world/2017/08/02/malaysia-seizes-ivory-pangolin-scales-from-africa.html
ENVIRONMENT,Spain says it will shut down country's oldest nuclear plant,http://www.foxnews.com/world/2017/08/01/spain-says-it-will-shut-down-countrys-oldest-nuclear-plant.html
ENVIRONMENT,"No visa, no veil? Saudi Arabia may ease rules for tourists",http://www.foxnews.com/world/2017/08/01/no-visa-no-veil-saudi-arabia-may-ease-rules-for-tourists.html
ENVIRONMENT,EU anti-fraud office wraps up Volkswagen loans probe,http://www.foxnews.com/world/2017/08/01/eu-anti-fraud-office-wraps-up-volkswagen-loans-probe.html
ENVIRONMENT,Human-wildlife conflict in India: 1 human killed every day,http://www.foxnews.com/world/2017/08/01/human-wildlife-conflict-in-india-1-human-killed-every-day.html
ENVIRONMENT,"Farmer suicides rise in India as climate warms, study shows",http://www.foxnews.com/world/2017/07/31/farmer-suicides-rise-in-india-as-climate-warms-study-shows.html
ENVIRONMENT,"Sinkhole shuts factory, halts riverboat traffic in Sweden",http://www.foxnews.com/world/2017/07/31/sinkhole-shuts-factory-halts-riverboat-traffic-in-sweden.html
ENVIRONMENT,Age of luxury: London's V&A to feature show on ocean liners,http://www.foxnews.com/world/2017/07/31/age-luxury-londons-v-to-feature-show-on-ocean-liners.html
ENVIRONMENT,Study finds aardvarks suffering as African climate heats up,http://www.foxnews.com/world/2017/07/31/study-finds-aardvarks-suffering-as-african-climate-heats-up.html
ENVIRONMENT,China criticizes British freedom of navigation mission plans,http://www.foxnews.com/world/2017/07/31/china-criticizes-british-freedom-navigation-mission-plans.html
ENVIRONMENT,Germany: Skyway mishap strands up to 100 cable car riders,http://www.foxnews.com/world/2017/07/30/germany-skyway-mishap-strands-up-to-100-cable-car-riders.html
ENVIRONMENT,Typhoon injures 81 in Taiwan as another storm approaches,http://www.foxnews.com/world/2017/07/29/typhoon-injures-81-in-taiwan-as-another-storm-approaches.html
ENVIRONMENT,The Latest: Icebreaker sets record for NW Passage transit,http://www.foxnews.com/world/2017/07/29/latest-icebreaker-sets-record-for-nw-passage-transit.html
ENVIRONMENT,"Spain: 300 evacuated as forest fire burns 1,000 hectares",http://www.foxnews.com/world/2017/07/29/spain-300-evacuated-as-forest-fire-burns-1000-hectares.html
ENVIRONMENT,Mayor demands immediate solution to Rome's water woes,http://www.foxnews.com/world/2017/07/28/mayor-demands-immediate-solution-to-romes-water-woes.html
ENVIRONMENT,EU court orders Poland to halt logging in ancient forest,http://www.foxnews.com/world/2017/07/28/eu-court-orders-poland-to-halt-logging-in-ancient-forest.html
ENVIRONMENT,Authorities seize 3 tons of pangolin scales in Ivory Coast,http://www.foxnews.com/world/2017/07/28/authorities-seize-3-tons-pangolin-scales-in-ivory-coast.html
ENVIRONMENT,How loss of Arctic sea ice further fuels global warming,http://www.foxnews.com/world/2017/07/27/how-loss-arctic-sea-ice-further-fuels-global-warming.html
ENVIRONMENT,Hurricane Hilary loses strength in Pacific west of Mexico,http://www.foxnews.com/world/2017/07/27/hurricane-hilary-loses-strength-in-pacific-west-mexico.html
ENVIRONMENT,Poacher in DiCaprio documentary acquitted of several charges,http://www.foxnews.com/world/2017/07/27/poacher-in-dicaprio-documentary-acquitted-several-charges.html
ENVIRONMENT,Indonesian villagers cut down forest in orangutan sanctuary,http://www.foxnews.com/world/2017/07/27/indonesian-villagers-cut-down-forest-in-orangutan-sanctuary.html
ENVIRONMENT,"Hurricane, tropical storm prowl Pacific Ocean far off Mexico",http://www.foxnews.com/world/2017/07/26/hurricane-tropical-storm-prowl-pacific-ocean-far-off-mexico.html
ENVIRONMENT,Tourists among 22 injured after boats collide in Puerto Rico,http://www.foxnews.com/world/2017/07/26/tourists-among-22-injured-after-boats-collide-in-puerto-rico.html
ENVIRONMENT,5 Indonesian provinces declare emergencies over forest fires,http://www.foxnews.com/world/2017/07/26/5-indonesian-provinces-declare-emergencies-over-forest-fires.html
ENVIRONMENT,Heavy rain leads to flooding in parts of Germany,http://www.foxnews.com/world/2017/07/26/heavy-rain-leads-to-flooding-in-parts-germany.html
WORLD,"2 dead, 500 hurt as deadly quake rattles Greece, Turkey",http://www.foxnews.com/world/2017/07/21/greece-quake-kills-two-sends-island-tourists-into-panic.html
WORLD,The Latest: Swede confirmed as one of those killed in quake,http://www.foxnews.com/world/2017/07/21/latest-quake-causes-minor-injuries-in-turkey.html
ENVIRONMENT,"Mexico City floating farms, chefs team up to save tradition",http://www.foxnews.com/world/2017/07/20/mexico-city-floating-farms-chefs-team-up-to-save-tradition.html
ENVIRONMENT,Son of Cecil the lion killed in Zimbabwean hunt,http://www.foxnews.com/world/2017/07/20/son-cecil-lion-killed-in-zimbabwean-hunt.html
THE AMERICAS,Canadian man builds park stairs for $550  even though city said project would cost $65G,http://www.foxnews.com/world/2017/07/20/canadian-man-builds-park-stairs-for-550-even-though-city-said-project-would-cost-65g.html
ENVIRONMENT,An African village's monkey guardian draws researchers,http://www.foxnews.com/world/2017/07/20/african-villages-monkey-guardian-draws-researchers.html
WORLD,Liu Xiaobo supporters mark his death amid concerns for widow,http://www.foxnews.com/world/2017/07/19/liu-xiaobo-supporters-mark-his-death-amid-concerns-for-widow.html
ENVIRONMENT,Swiss identify glacier bodies as couple missing since 1942,http://www.foxnews.com/world/2017/07/19/swiss-identify-glacier-bodies-as-couple-missing-since-1942.html
DIGGING HISTORY,"Glacier in Swiss Alps melts, revealing couple who disappeared 70 years ago",http://www.foxnews.com/science/2017/07/18/glacier-in-swiss-alps-melts-revealing-couple-who-disappeared-70-years-ago.html
ENVIRONMENT,"France fights forest fires near Nice, in Provence, Corsica",http://www.foxnews.com/world/2017/07/18/france-fights-forest-fires-near-nice-in-provence-corsica.html
ENVIRONMENT,"Global warming melts ice, alters fabled Northwest Passage",http://www.foxnews.com/world/2017/07/17/global-warming-melts-ice-alters-fabled-northwest-passage.html
ENVIRONMENT,At least 100 tourists forced to evacuate in Montenegro fires,http://www.foxnews.com/world/2017/07/17/at-least-100-tourists-forced-to-evacuate-in-montenegro-fires.html
WORLD,Royal tradition: Counting the swans on the River Thames,http://www.foxnews.com/world/2017/07/17/royal-tradition-counting-swans-on-river-thames.html
ENVIRONMENT,South Africa fighting perceptions on rhino horn trade,http://www.foxnews.com/world/2017/07/17/south-africa-fighting-perceptions-on-rhino-horn-trade.html
EUROPE,Macron: My charm may have changed Trump's mind on climate change,http://www.foxnews.com/world/2017/07/16/macron-my-charm-may-have-changed-trumps-mind-on-climate-change.html
ENVIRONMENT,"Wildfires rage along Adriatic coast in Croatia, Montenegro",http://www.foxnews.com/world/2017/07/16/wildfires-rage-along-adriatic-coast-in-croatia-montenegro.html
ENVIRONMENT,16 Indian pilgrims killed as bus falls into gorge in Kashmir,http://www.foxnews.com/world/2017/07/16/11-indian-pilgrims-killed-as-bus-falls-into-gorge-in-kashmir.html
ENVIRONMENT,5 Congo rangers dead; US journalist found alive in NE Congo,http://www.foxnews.com/world/2017/07/16/5-congo-rangers-dead-us-journalist-found-alive-in-ne-congo.html
ENVIRONMENT,"6 Congo rangers safe; US journalist, 3 others still missing",http://www.foxnews.com/world/2017/07/15/congo-militia-kidnaps-us-journalist-11-park-guards.html
ENVIRONMENT,Romania: 11 Hungarian tourists rescued from mountain,http://www.foxnews.com/world/2017/07/15/romania-11-hungarian-tourists-rescued-from-mountain.html
ENVIRONMENT,Official says water in Pakistan reservoir is fine,http://www.foxnews.com/world/2017/07/15/official-says-water-in-pakistan-reservoir-is-fine.html
ENVIRONMENT,Brazil's Environment Min proposes shrinking Amazon reserve,http://www.foxnews.com/world/2017/07/14/brazils-environment-min-proposes-shrinking-amazon-reserve.html
ENVIRONMENT,Fernanda becomes a powerful Category 4 hurricane in Pacific,http://www.foxnews.com/world/2017/07/14/fernanda-becomes-category-2-hurricane-in-eastern-pacific.html
RELIGION,"Egypt attacks: 2 German female tourists, 5 policemen killed",http://www.foxnews.com/world/2017/07/14/egypts-state-run-media-says-attack-kills-5-police-in-giza.html
WORLD,The Latest: Official: 2 tourists slain in Egypt were German,http://www.foxnews.com/world/2017/07/14/latest-attacker-stabs-6-foreign-tourists-in-egypt-hotel.html
ENVIRONMENT,3 escaped lions in South Africa are shot and killed,http://www.foxnews.com/world/2017/07/14/3-escaped-lions-in-south-africa-are-shot-and-killed.html
ENVIRONMENT,"In rare sight, lioness nurses leopard cub in Tanzania",http://www.foxnews.com/world/2017/07/14/in-rare-sight-lioness-nurses-leopard-cub-in-tanzania.html
TERRORISM,"The Latest: Trumps, Macrons dine high above Paris",http://www.foxnews.com/world/2017/07/13/latest-trump-macron-meeting-in-paris-for-bastille-day.html
ENVIRONMENT,Hurricane Fernanda strengthens in Pacific; no threat to land,http://www.foxnews.com/world/2017/07/13/fernanda-becomes-hurricane-in-pacific-but-no-threat-to-land.html
US,Fisherman killed saving whale recalled as longtime advocate,http://www.foxnews.com/us/2017/07/13/us-suspends-efforts-to-free-tangled-whales-after-death.html
ENVIRONMENT,UN envoy warns of instability in Sahel and Lake Chad basin,http://www.foxnews.com/world/2017/07/13/un-envoy-warns-instability-in-sahel-and-lake-chad-basin.html
ENVIRONMENT,Britain's Natural History Museum unveils huge whale skeleton,http://www.foxnews.com/world/2017/07/13/britains-natural-history-museum-unveils-giant-blue-whale.html
WORLD,"Italian wildfires kill 2 homeowners, force tourists to flee",http://www.foxnews.com/world/2017/07/13/vacationers-in-tense-evacuation-from-sicily-wild-fires.html
ENVIRONMENT,The Latest: 2 property owners die battling Italian wildfire,http://www.foxnews.com/world/2017/07/13/latest-2-property-owners-die-battling-italian-wildfire.html
ENVIRONMENT,Poland glad to face EU court over logging in ancient forest,http://www.foxnews.com/world/2017/07/13/eu-takes-poland-to-court-over-logging-in-pristine-forest.html
ENVIRONMENT,Watchdog: At least 200 environmental activists slain in 2016,http://www.foxnews.com/world/2017/07/13/watchdog-at-least-200-environmental-activists-slain-in-2016.html
WORLD,Trump envoy helps broker Israeli-Palestinian water deal,http://www.foxnews.com/world/2017/07/13/israel-freezes-plan-to-give-palestinian-city-land-to-expand.html
ENVIRONMENT,Militants find sanctuary in Libya's wild south,http://www.foxnews.com/world/2017/07/13/militants-find-sanctuary-in-libyas-wild-south.html
ENVIRONMENT,"AP PHOTOS: As Indonesia cuts forests, fake nature thrives",http://www.foxnews.com/world/2017/07/13/ap-photos-as-indonesia-cuts-forests-fake-nature-thrives.html
ENVIRONMENT,Tropical Storm Fernanda forms off Mexico in Pacific,http://www.foxnews.com/world/2017/07/12/tropical-storm-fernanda-forms-off-mexico-in-pacific.html
ENVIRONMENT,Sicily tourist resort evacuated as Italy wildfires spread,http://www.foxnews.com/world/2017/07/12/sicily-tourist-resort-evacuated-as-italy-wildfires-spread.html
ENVIRONMENT,'Pen-Pineapple-Apple-Pen' and the UN have a new rhyme,http://www.foxnews.com/world/2017/07/12/pen-pineapple-apple-pen-and-un-have-new-rhyme.html
WORLD,India police warned weeks ago of attack on Hindus in Kashmir,http://www.foxnews.com/world/2017/07/11/hindus-continue-pilgrimage-in-kashmir-after-7-die-in-attack.html
ENVIRONMENT,NGOs ask International Criminal Court for Mexico probe,http://www.foxnews.com/world/2017/07/11/ngos-ask-international-criminal-court-for-mexico-probe.html
WORLD,The Latest: Trump says US committed to total defeat of IS,http://www.foxnews.com/world/2017/07/11/latest-un-asks-iraq-safeguard-human-rights-in-mosul.html
WORLD,"Trial in 2015 Tunisian museum attack opens, to be postponed",http://www.foxnews.com/world/2017/07/11/trial-24-suspects-in-2015-tunisian-museum-attack-opens.html
ENVIRONMENT,"Wildfires rage in southern Italy, Vesuvius slopes",http://www.foxnews.com/world/2017/07/11/wildfires-rage-in-southern-italy-vesuvius-slopes.html
WORLD,Strong quake strikes off New Zealand; no injuries reported,http://www.foxnews.com/world/2017/07/11/strong-quake-strikes-off-new-zealand-no-injuries-reported.html
ENVIRONMENT,"Eugene now tropical storm, but could whip up California surf",http://www.foxnews.com/world/2017/07/10/hurricane-eugene-weaker-but-could-whip-up-california-surf.html
ENVIRONMENT,By the numbers: The fight against Islamic State in Iraq,http://www.foxnews.com/world/2017/07/10/by-numbers-fight-against-islamic-state-in-iraq.html
ENVIRONMENT,German prosecutors probe Porsche employees over diesel cars,http://www.foxnews.com/world/2017/07/10/german-prosecutors-probe-porsche-employees-over-diesel-cars.html
ENVIRONMENT,South African park rangers search for 4 escaped lions,http://www.foxnews.com/world/2017/07/10/south-african-park-rangers-search-for-4-escaped-lions.html
ENVIRONMENT,Police patrol for poachers as animals flee flooding in India,http://www.foxnews.com/world/2017/07/10/police-patrol-for-poachers-as-animals-flee-flooding-in-india.html
ENVIRONMENT,German official to hold talks with Turkey on climate issue,http://www.foxnews.com/world/2017/07/10/german-official-to-hold-talks-with-turkey-on-climate-issue.html
ENVIRONMENT,"Old German caves, Poland silver mines make UN heritage list",http://www.foxnews.com/world/2017/07/09/old-german-caves-poland-silver-mines-make-un-heritage-list.html
ENVIRONMENT,Fire art in South Africa promotes healthy grasslands,http://www.foxnews.com/world/2017/07/09/fire-art-in-south-africa-promotes-healthy-grasslands.html
WORLD,Peaceful protests mark end of G-20 summit hours after riots,http://www.foxnews.com/world/2017/07/08/anti-g20-activists-riot-overnight-in-hamburg.html
CLIMATE CHANGE,G-20 summit: Trump blocked out on Paris climate accord as 19 members reaffirm,http://www.foxnews.com/world/2017/07/08/g-20-summit-trump-blocked-out-on-paris-climate-accord-as-19-members-reaffirm.html
WORLD,Thai police say they made progress in ivory trade crackdown,http://www.foxnews.com/world/2017/07/07/police-in-thailand-say-ivory-trade-crackdown-is-successful.html
ENVIRONMENT,"Germany hosts 'difficult' G-20 talks on trade, climate",http://www.foxnews.com/world/2017/07/07/g-20-summit-in-germany-to-discuss-terror-trade-climate.html
WORLD,European banks exit Honduras dam project after killings,http://www.foxnews.com/world/2017/07/07/european-banks-out-honduras-dam-project-after-killings.html
ENVIRONMENT,Worsening drought forces Portugal to introduce restrictions,http://www.foxnews.com/world/2017/07/07/worsening-drought-forces-portugal-to-introduce-restrictions.html
ENVIRONMENT,Group finds Asia's performing elephants are treated harshly,http://www.foxnews.com/world/2017/07/05/group-finds-asias-performing-elephants-are-treated-harshly.html
WORLD,Jellyfish invasion stirs debate over Egypt's Suez Canal,http://www.foxnews.com/world/2017/07/06/jellyfish-invasion-stirs-debate-over-egypts-suez-canal.html
WORLD,At least 14 reported dead in gunbattle between Mexican gangs,http://www.foxnews.com/world/2017/07/05/at-least-26-reported-dead-in-clash-mexican-gangs.html
ENVIRONMENT,UNESCO wants Poland to stop logging in part of pristine wood,http://www.foxnews.com/world/2017/07/05/unesco-wants-poland-to-stop-logging-in-part-pristine-wood.html
ENVIRONMENT,Tensions high in Himalayas as China demands India withdrawal,http://www.foxnews.com/world/2017/07/05/tensions-high-in-himalayas-as-china-demands-india-withdrawal.html
ENVIRONMENT,"US-Cuba sea mission finds healthy reefs, invasive lionfish",http://www.foxnews.com/world/2017/07/04/us-cuba-sea-mission-finds-healthy-reefs-invasive-lionfish.html
ENVIRONMENT,Fire breaks out on floating nuclear plant at Russia shipyard,http://www.foxnews.com/world/2017/07/04/fire-breaks-out-on-floating-nuclear-plant-at-russia-shipyard.html
ENVIRONMENT,Montenegrin firefighters battle wildfire on Adriatic coast,http://www.foxnews.com/world/2017/07/04/montenegrin-firefighters-battle-wildfire-on-adriatic-coast.html
ENVIRONMENT,Tanzania dam project said to affect World Heritage site,http://www.foxnews.com/world/2017/07/04/dam-project-in-tanzanias-selous-reserve-stirs-dispute.html
ENVIRONMENT,Vietnam's capital to ban motorbikes in metro areas by 2030,http://www.foxnews.com/world/2017/07/04/vietnams-capital-to-ban-motorbikes-in-metro-areas-by-2030.html
WORLD,"Forest fires injure 9 firefighters in Portugal, 2 seriously",http://www.foxnews.com/world/2017/07/03/forest-fire-injures-6-firefighters-in-portugal.html
ENVIRONMENT,Angola slowly opens to conservationists after long civil war,http://www.foxnews.com/world/2017/07/03/angola-slowly-opens-to-conservationists-after-long-civil-war.html
ENVIRONMENT,"Ice Age art, Bauhaus buildings highlight German UNESCO hopes",http://www.foxnews.com/world/2017/07/03/ice-age-art-bauhaus-buildings-highlight-german-unesco-hopes.html
ENVIRONMENT,Aid helicopter crash kills 8 after Indonesian volcano erupts,http://www.foxnews.com/world/2017/07/02/10-injured-as-volcano-erupts-on-indonesias-main-java-island.html
ENVIRONMENT,The Latest: Indonesian aid helicopter crash kills 8 rescuers,http://www.foxnews.com/world/2017/07/02/latest-indonesian-aid-helicopter-crash-kills-8-rescuers.html
WORLD,Oil tanker collides with cargo ship in Dover Strait off UK,http://www.foxnews.com/world/2017/07/01/oil-tanker-and-large-cargo-ship-collide-in-english-channel.html
ENVIRONMENT,Pakistan: 2 Climbers missing on Killer Mountain assumed dead,http://www.foxnews.com/world/2017/07/01/pakistan-2-climbers-missing-on-killer-mountain-assumed-dead.html
ENVIRONMENT,Mexico bans gillnet fishing in endangered porpoise's habitat,http://www.foxnews.com/world/2017/06/30/mexico-bans-gillnet-fishing-in-endangered-porpoises-habitat.html
ENVIRONMENT,Body of German hiker retrieved from Indonesian volcano,http://www.foxnews.com/world/2017/06/30/body-german-hiker-retrieved-from-indonesian-volcano.html
ENVIRONMENT,Polish official to defend old forest actions before UNESCO,http://www.foxnews.com/world/2017/06/30/polish-official-to-defend-old-forest-actions-before-unesco.html
ENVIRONMENT,UN human rights experts condemn jailing of Vietnam blogger,http://www.foxnews.com/world/2017/06/30/un-human-rights-experts-condemn-jailing-vietnam-blogger.html
ENVIRONMENT,Body possibly of German hiker found on Indonesian volcano,http://www.foxnews.com/world/2017/06/29/german-hiker-missing-on-indonesian-volcano-found-dead.html
ENVIRONMENT,"Europeans line up behind Paris accord, free trade before G20",http://www.foxnews.com/world/2017/06/29/merkel-before-g20-paris-accord-irreversible-not-negotiable.html
WORLD,Whale-watching comes under scrutiny at South Africa meeting,http://www.foxnews.com/world/2017/06/29/whale-watching-comes-under-scrutiny-at-south-africa-meeting.html
ENVIRONMENT,"Pakistan resort cable car lift plunges into ravine, kills 10",http://www.foxnews.com/world/2017/06/29/pakistan-resort-cable-car-lift-plunges-into-ravine-kills-10.html
WORLD,Blame game in Portugal over wildfire that killed 64 people,http://www.foxnews.com/world/2017/06/28/portugal-seeks-culprits-for-wildfire-that-killed-64.html
ENVIRONMENT,South Africa approves export of 800 lion skeletons this year,http://www.foxnews.com/world/2017/06/28/south-africa-approves-export-800-lion-skeletons-this-year.html
ENVIRONMENT,2 Climbers go missing on Pakistan's 'Killer Mountain',http://www.foxnews.com/world/2017/06/28/2-climbers-go-missing-on-pakistans-killer-mountain.html
ENVIRONMENT,Cambodia conservationists find rare cache of crocodile eggs,http://www.foxnews.com/world/2017/06/28/cambodia-conservationists-find-rare-cache-crocodile-eggs.html
ENVIRONMENT,Nuclear waste containers shipped on river in Germany,http://www.foxnews.com/world/2017/06/28/nuclear-waste-containers-shipped-on-river-in-germany.html
FIRES,"Forest fire that threatened UNESCO park in Spain 'under control,' officials say",http://www.foxnews.com/world/2017/06/27/forest-fire-that-threatened-unesco-park-in-spain-under-control-officials-say.html
WORLD,Brazil's crisis deepens as president accused of corruption,http://www.foxnews.com/world/2017/06/26/brazil-leader-defiant-in-face-possible-charges.html
ENVIRONMENT,Hurricane Dora moving away from Mexico's southwest coast,http://www.foxnews.com/world/2017/06/26/hurricane-dora-strengthens-off-mexicos-pacific-coast.html
DIGGING HISTORY,Subway digging uncovers 'Pompeii-like scene' in Rome,http://www.foxnews.com/science/2017/06/26/subway-digging-uncovers-pompeii-like-scene-in-rome.html
ENVIRONMENT,German hiker missing on dormant Indonesian volcano,http://www.foxnews.com/world/2017/06/26/german-hiker-missing-on-dormant-indonesian-volcano.html
ENVIRONMENT,Rhino breeder in South Africa plans online auction of horn,http://www.foxnews.com/world/2017/06/26/rhino-breeder-in-south-africa-plans-online-auction-horn.html
ENVIRONMENT,Battle resumes to extinguish fire near Spain national park,http://www.foxnews.com/world/2017/06/26/battle-resumes-to-extinguish-fire-near-spains-donana-park.html
ENVIRONMENT,"Coal on the rise in China, US, India after major 2016 drop",http://www.foxnews.com/world/2017/06/26/coal-on-rise-in-china-us-india-after-major-2016-drop.html
WORLD,"The Latest: Santos: 6 dead, 31 missing in Colombia capsizing",http://www.foxnews.com/world/2017/06/25/latest-30-missing-after-tourist-boat-sinks-in-colombia.html
ENVIRONMENT,New Zealand law student launches climate change court case,http://www.foxnews.com/world/2017/06/26/new-zealand-law-student-launches-climate-change-court-case.html
ENVIRONMENT,Tropical Storm Dora strengthens off Mexico's Pacific coast,http://www.foxnews.com/world/2017/06/26/tropical-storm-dora-strengthens-off-mexicos-pacific-coast.html
WORLD,Dozens missing after tourist boat sinks in Colombia,http://www.foxnews.com/world/2017/06/25/recreational-boat-with-150-aboard-sinks-near-colombian-city.html
ENVIRONMENT,Tropical Storm Dora forms off Mexico's Pacific coast,http://www.foxnews.com/world/2017/06/25/tropical-storm-dora-forms-off-mexicos-pacific-coast.html
ENVIRONMENT,Forest fire in Spain threatens renowned national park,http://www.foxnews.com/world/2017/06/25/crews-fight-forest-fire-near-spains-donana-nature-reserve.html
ENVIRONMENT,Schwarzenegger talks climate change with French president,http://www.foxnews.com/world/2017/06/23/schwarzenegger-talks-climate-change-with-french-president.html
ENVIRONMENT,Norway to Brazil: Curb deforestation or we stop the money,http://www.foxnews.com/world/2017/06/23/norway-to-brazil-stop-deforestation-or-stop-money.html
WORLD,South Korea's infrastructure boondoggle a boon for cyclists,http://www.foxnews.com/world/2017/06/22/south-koreas-infrastructure-boondoggle-boon-for-cyclists.html
ENVIRONMENT,Israel: Hezbollah uses NGO to conceal border posts,http://www.foxnews.com/world/2017/06/22/israel-hezbollah-sets-up-border-posts-under-guise-ngo.html
ENVIRONMENT,Bad weather hampers search for missing US climber,http://www.foxnews.com/world/2017/06/22/bad-weather-hampers-search-for-missing-us-climber.html
ENVIRONMENT,One of Africa's largest wildlife relocations begins,http://www.foxnews.com/world/2017/06/21/one-africas-largest-wildlife-relocations-begins.html
ENVIRONMENT,"Portugal tries to contain fatal fires, debunks plane crash",http://www.foxnews.com/world/2017/06/20/portugal-battles-to-contain-deadly-wildfires-amid-heat-wind.html
WORLD,The Latest: Portuguese official says no fire planes crashed,http://www.foxnews.com/world/2017/06/20/latest-water-dropping-plane-crash-reported-in-portugal.html
