category,headline,url
ASIA,2 stuntmen drown after jumping into lake for Indian movie,http://www.foxnews.com/world/2016/11/08/2-stuntmen-drown-after-jumping-into-lake-for-indian-movie.html
EUROPE,UN climate chief: No doubt world will shift to low emissions,http://www.foxnews.com/world/2016/11/07/un-climate-chief-no-doubt-world-will-shift-to-low-emissions.html
EUROPE,"Vietnam, Ireland agree to cooperation on education, energy",http://www.foxnews.com/world/2016/11/07/vietnam-ireland-agree-to-cooperation-on-education-energy.html
EUROPE,Pope: Bankrupt morals to save banks but not suffering people,http://www.foxnews.com/world/2016/11/05/pope-bankrupt-morals-to-save-banks-but-not-suffering-people.html
UNITED NATIONS,Fish vendor's death troubles Morocco ahead of climate talks,http://www.foxnews.com/world/2016/11/05/fish-vendor-death-troubles-morocco-ahead-climate-talks.html
ASIA,Polluted smog covers Pakistan's city of Lahore,http://www.foxnews.com/world/2016/11/05/polluted-smog-covers-pakistan-city-lahore.html
ASIA,India's capital grapples with toxic winter air pollution,http://www.foxnews.com/world/2016/11/05/india-capital-grapples-with-toxic-winter-air-pollution.html
ASIA,China pledges 18-percent carbon emissions cut by 2020,http://www.foxnews.com/world/2016/11/05/china-pledges-18-percent-carbon-emissions-cut-by-2020.html
EUROPE,Eiffel Tower lit green in honor of Paris climate change deal,http://www.foxnews.com/world/2016/11/04/eiffel-tower-lit-green-in-honor-paris-climate-change-deal.html
THE AMERICAS,"1 year after Brazil dam break, residents don't trust water",http://www.foxnews.com/world/2016/11/04/1-year-after-brazil-dam-break-residents-dont-trust-water.html
EUROPE,Paris climate agreement becomes international law,http://www.foxnews.com/world/2016/11/04/paris-climate-agreement-becomes-international-law.html
THE AMERICAS,"'Zombies' in Rio groan, lurch at tourists along Copacabana",http://www.foxnews.com/world/2016/11/02/zombies-in-rio-groan-lurch-at-tourists-along-copacabana.html
ENVIRONMENT,Saudis award water prize to 8 scientists,http://www.foxnews.com/world/2016/11/02/saudis-award-water-prize-to-8-scientists.html
ENVIRONMENT,Militants bomb Nigerian state-owned Trans Forcados pipeline,http://www.foxnews.com/world/2016/11/02/militants-bomb-nigerian-state-owned-trans-forcados-pipeline.html
PACIFIC,New MH370 analysis suggests no one at controls during crash,http://www.foxnews.com/world/2016/11/01/new-mh370-analysis-suggests-no-one-at-controls-during-crash0.html
THE AMERICAS,US billionaire settles with Cayman Islands over reef damage,http://www.foxnews.com/world/2016/11/01/us-billionaire-settles-with-cayman-islands-over-reef-damage.html
THE AMERICAS,Grotto collapses in Brazil kills worshippers,http://www.foxnews.com/world/2016/11/01/grotto-collapses-in-brazil-kills-worshippers.html
EUROPE,"Full of filth and hope, Calais migrant camp is no more",http://www.foxnews.com/world/2016/11/01/full-filth-and-hope-calais-migrant-camp-is-no-more.html
ENVIRONMENT,"After days of heavy rain, Egypt's Nile turns murky brown",http://www.foxnews.com/world/2016/11/01/after-days-heavy-rain-egypt-nile-turns-murky-brown.html
ASIA,Nepal drains dangerous glacial lake to safe level,http://www.foxnews.com/world/2016/11/01/nepal-drains-dangerous-glacial-lake-to-safe-level.html
RELIGION,Sri Lanka cracks down on owners of elephants taken from wild,http://www.foxnews.com/world/2016/11/01/sri-lanka-cracks-down-on-owners-elephants-taken-from-wild.html
THE AMERICAS,Mexico rescues 2 abandoned jaguar cubs,http://www.foxnews.com/world/2016/10/31/mexico-rescues-2-abandoned-jaguar-cubs.html
THE AMERICAS,Mexico: Deforestation for avocados much higher than thought,http://www.foxnews.com/world/2016/10/31/mexico-deforestation-for-avocados-much-higher-than-thought.html
ATMOSPHERE,UNICEF says 2 billion children breathe toxic air,http://www.foxnews.com/world/2016/10/31/unicef-says-2-billion-children-breathe-toxic-air.html
ENVIRONMENT,"Zimbabwean lion, companion to Cecil, dies of natural causes",http://www.foxnews.com/world/2016/10/31/zimbabwean-lion-companion-to-cecil-dies-natural-causes.html
US,Recent developments surrounding the South China Sea,http://www.foxnews.com/world/2016/10/31/recent-developments-surrounding-south-china-sea.html
ASIA,"At Afghanistan's brick kilns, debt can last generations",http://www.foxnews.com/world/2016/10/28/at-afghanistan-brick-kilns-debt-can-last-generations.html
EUROPE,Countries OK world's largest marine reserve in Antarctica,http://www.foxnews.com/world/2016/10/28/countries-ok-world-largest-marine-reserve-in-antarctica.html
EUROPE,Countries agree on huge marine reserve for Antarctica,http://www.foxnews.com/world/2016/10/27/countries-agree-on-huge-marine-reserve-for-antarctica.html
EUROPE,Study predicts deserts in Spain if global warming continues,http://www.foxnews.com/world/2016/10/27/study-predicts-deserts-in-spain-if-global-warming-continues.html
EUROPE,Hikers replace soldiers in Czech army zone turned reserve,http://www.foxnews.com/world/2016/10/27/hikers-replace-soldiers-in-czech-army-zone-turned-reserve.html
EUROPE,Report: Wildlife populations halved on average since '70s,http://www.foxnews.com/world/2016/10/27/report-wildlife-populations-halved-on-average-since-70s.html
ASIA,Rehabilitated orangutans freed in Borneo as species dwindles,http://www.foxnews.com/world/2016/10/26/rehabilitated-orangutans-freed-in-borneo-as-species-dwindles.html
EUROPE,UK to decide which airport expansion proposal to accept,http://www.foxnews.com/world/2016/10/25/uk-to-decide-which-airport-expansion-proposal-to-accept.html
ENVIRONMENT,UN says carbon dioxide at record levels,http://www.foxnews.com/world/2016/10/24/un-says-carbon-dioxide-at-record-levels.html
ENVIRONMENT,Struggling Gaza factory turns to recycling to survive,http://www.foxnews.com/world/2016/10/24/struggling-gaza-factory-turns-to-recycling-to-survive.html
ASIA,Police search forests in India after 21 Maoist rebels killed,http://www.foxnews.com/world/2016/10/24/police-search-forests-in-india-after-21-maoist-rebels-killed.html
PACIFIC,Surfer is third Australian shark attack victim in a month,http://www.foxnews.com/world/2016/10/23/surfer-is-third-australian-shark-attack-victim-in-month.html
ASIA,First woman to climb Mount Everest dead at 77,http://www.foxnews.com/world/2016/10/22/junko-tabei-first-woman-to-climb-everest-dies-at-77.html
THE AMERICAS,"In Paraguay, 100 horses are protected, traded for moto-carts",http://www.foxnews.com/world/2016/10/21/in-paraguay-100-horses-are-protected-traded-for-moto-carts.html
THE AMERICAS,"21 Brazilian, foreign mining executives charged in dam burst",http://www.foxnews.com/world/2016/10/20/21-brazilian-foreign-mining-executives-charged-in-dam-burst.html
PACIFIC,"American sets to cross Pacific in reed boat, reach Australia",http://www.foxnews.com/world/2016/10/20/american-sets-to-cross-pacific-in-reed-boat-reach-australia.html
ASIA,UNESCO urges halt to plan for Bangladesh coal plant in delta,http://www.foxnews.com/world/2016/10/20/unesco-urges-halt-to-plan-for-bangladesh-coal-plant-in-delta.html
ASIA,48 bodies recovered after ferry capsizing on Myanmar river,http://www.foxnews.com/world/2016/10/19/48-bodies-recovered-after-ferry-capsizing-on-myanmar-river.html
EUROPE,Mekong effort fails after years of lavish foreign funding,http://www.foxnews.com/world/2016/10/19/mekong-effort-fails-after-years-lavish-foreign-funding.html
EUROPE,DNA study reveals European bison's extinct parentage,http://www.foxnews.com/world/2016/10/18/dna-study-reveals-european-bison-extinct-parentage.html
EUROPE,Green groups sue Norway over Barents Sea oil drilling,http://www.foxnews.com/world/2016/10/18/green-groups-sue-norway-over-barents-sea-oil-drilling.html
ENVIRONMENT,UN continues to support DiCaprio's work on climate change,http://www.foxnews.com/world/2016/10/17/un-continues-to-support-dicaprio-work-on-climate-change.html
ASIA,Kenya: China petitioned to stop building railway in park,http://www.foxnews.com/world/2016/10/17/kenya-china-petitioned-to-stop-building-railway-in-park.html
PACIFIC,Recent developments surrounding the South China Sea,http://www.foxnews.com/world/2016/10/17/recent-developments-surrounding-south-china-sea.html
ASIA,"Jia Jia, world's oldest-ever captive panda, dies at 38",http://www.foxnews.com/world/2016/10/16/jia-jia-world-oldest-ever-captive-panda-dies-at-38.html
EUROPE,"Cave etchings 14,500 years old found in northern Spain",http://www.foxnews.com/world/2016/10/15/cave-etchings-14500-years-old-found-in-northern-spain.html
EUROPE,Central European nations oppose Russian-German gas pipeline,http://www.foxnews.com/world/2016/10/15/central-european-nations-oppose-russian-german-gas-pipeline.html
ENVIRONMENT,Egypt's el-Sissi predicts long war against Sinai militants,http://www.foxnews.com/world/2016/10/15/egypt-el-sissi-predicts-long-war-against-sinai-militants.html
EUROPE,The Latest: Security tight at India beach resort for BRICS,http://www.foxnews.com/world/2016/10/15/latest-security-tight-at-india-beach-resort-for-brics.html
US,AP Explains: What the new global climate agreement means,http://www.foxnews.com/world/2016/10/15/ap-explains-what-new-global-climate-agreement-means.html
ASIA,Global deal reached to limit powerful greenhouse gases,http://www.foxnews.com/world/2016/10/15/global-deal-reached-to-limit-powerful-greenhouse-gases.html
ASIA,Thailand's tourism likely to weather king's mourning period,http://www.foxnews.com/world/2016/10/14/thailand-tourism-likely-to-weather-king-mourning-period.html
THE AMERICAS,Environmentalists free orphaned sea lions near Peru capital,http://www.foxnews.com/world/2016/10/14/environmentalists-free-orphaned-sea-lions-near-peru-capital.html
EUROPE,Hungary's anti-migrant fence disrupts wildlife habitats,http://www.foxnews.com/world/2016/10/14/hungary-anti-migrant-fence-disrupts-wildlife-habitats.html
THE AMERICAS,AP Explains: Why potent greenhouse gases are meeting's focus,http://www.foxnews.com/world/2016/10/14/ap-explains-why-potent-greenhouse-gases-are-meeting-focus.html
EUROPE,Wildlife groups warns of risks after gorilla's brief escape,http://www.foxnews.com/world/2016/10/14/wildlife-groups-warns-risks-after-gorilla-brief-escape.html
ASIA,Nations seek deal to phase out HFCs; could cut temperatures,http://www.foxnews.com/world/2016/10/14/nations-seek-deal-to-phase-out-hfcs-could-cut-temperatures.html
EUROPE,2 Polish mountain climbers die in the Himalayas,http://www.foxnews.com/world/2016/10/13/2-polish-mountain-climbers-die-in-himalayas.html
THE AMERICAS,Hurricane Matthew relief effort in Haiti enters new phase,http://www.foxnews.com/world/2016/10/13/hurricane-matthew-relief-effort-in-haiti-enters-new-phase.html
THE AMERICAS,Powerful greenhouse gases in focus at global climate meeting,http://www.foxnews.com/world/2016/10/13/powerful-greenhouse-gases-in-focus-at-global-climate-meeting.html
ENVIRONMENT,"Jordan's airborne monuments men discover, protect sites",http://www.foxnews.com/world/2016/10/12/jordan-airborne-monuments-men-discover-protect-sites.html
PACIFIC,Australian surfer injured in suspected shark attack,http://www.foxnews.com/world/2016/10/12/australian-surfer-injured-in-suspected-shark-attack.html
EUROPE,Baltic cod fishermen get better quotas than science wants,http://www.foxnews.com/world/2016/10/10/baltic-cod-fishermen-get-better-quotas-than-science-wants.html
EUROPE,Danish fishermen fear further slashing of EU's cod quotas,http://www.foxnews.com/world/2016/10/10/danish-fishermen-fear-further-slashing-eu-cod-quotas.html
EUROPE,Success: UK group says 2 endangered rhinos have given birth,http://www.foxnews.com/world/2016/10/09/success-uk-group-says-2-endangered-rhinos-have-given-birth.html
ASIA,Volcano in southern Japan erupts; no injuries,http://www.foxnews.com/world/2016/10/07/volcano-in-southern-japan-erupts-no-injuries.html
EUROPE,"EU celebrates Paris Agreement, claims credit at UN",http://www.foxnews.com/world/2016/10/07/eu-celebrates-paris-agreement-claims-credit-at-un.html
ASIA,Vietnam seizes over 2 tons of elephant tusks from Mozambique,http://www.foxnews.com/world/2016/10/07/vietnam-seizes-over-2-tons-elephant-tusks-from-mozambique.html
PACIFIC,Wing part found on Mauritius confirmed to be part of MH370,http://www.foxnews.com/world/2016/10/07/wing-part-found-on-mauritius-confirmed-to-be-part-mh370.html
EUROPE,"Greek islanders, White Helmets top Nobel Peace Prize betting",http://www.foxnews.com/world/2016/10/06/greek-islanders-white-helmets-top-nobel-peace-prize-betting.html
THE AMERICAS,Haiti starting to gauge full damage from Matthew's rampage,http://www.foxnews.com/world/2016/10/06/haiti-starting-to-gauge-full-damage-from-matthew-rampage.html
EUROPE,Paris climate agreement to take effect in 30 days,http://www.foxnews.com/world/2016/10/05/paris-climate-agreement-to-take-effect-in-30-days.html
US,Bahamas next up for Matthew after destructive path in Haiti,http://www.foxnews.com/world/2016/10/05/bahamas-next-up-for-matthew-after-destructive-path-in-haiti.html
ASIA,New ban on pangolin trade may help most trafficked mammal,http://www.foxnews.com/world/2016/10/05/new-ban-on-pangolin-trade-may-help-most-trafficked-mammal.html
ENVIRONMENT,UN wildlife meeting ends with conservation agreements,http://www.foxnews.com/world/2016/10/04/un-wildlife-meeting-ends-with-conservation-agreements.html
EUROPE,Paris climate pact set to enter force after EU greenlight,http://www.foxnews.com/world/2016/10/04/paris-climate-pact-set-to-enter-force-after-eu-greenlight.html
DISASTERS,The Latest: Hurricane warning issued for the Bahamas,http://www.foxnews.com/world/2016/10/04/latest-hurricane-warning-issued-for-bahamas.html
ASIA,Taiwan seeks to improve conditions in fishing fleet,http://www.foxnews.com/world/2016/10/04/taiwan-seeks-to-improve-conditions-in-fishing-fleet.html
US,Haiti's southwest hunkers down in night of fury from Matthew,http://www.foxnews.com/world/2016/10/04/haiti-southwest-hunkers-down-in-night-fury-from-matthew.html
ENVIRONMENT,Top African wildlife park looks to villages to stop poachers,http://www.foxnews.com/world/2016/10/04/top-african-wildlife-park-looks-to-villages-to-stop-poachers.html
THE AMERICAS,Theft of case files in environmentalist killing worries UN,http://www.foxnews.com/world/2016/10/03/theft-case-files-in-environmentalist-killing-worries-un.html
EUROPE,Putin visits wild horse reserve in Urals,http://www.foxnews.com/world/2016/10/03/putin-visits-wild-horse-reserve-in-urals.html
THE AMERICAS,Trudeau says Canada to implement carbon tax,http://www.foxnews.com/world/2016/10/03/trudeau-says-canada-to-implement-carbon-tax.html
ENVIRONMENT,Activists ask Kenya's president stop railway crossing park,http://www.foxnews.com/world/2016/10/03/activists-ask-kenya-president-stop-railway-crossing-park.html
ASIA,Swaziland's bid to sell rhino horn fails at UN meeting,http://www.foxnews.com/world/2016/10/03/swaziland-bid-to-sell-rhino-horn-fails-at-un-meeting.html
US,"The Latest: Major hurricane a threat to Haiti, Jamaica, Cuba",http://www.foxnews.com/world/2016/10/03/latest-major-hurricane-threat-to-haiti-jamaica-cuba.html
US,"Powerful Hurricane Matthew a threat to Haiti, Jamaica, Cuba",http://www.foxnews.com/world/2016/10/03/powerful-hurricane-matthew-threat-to-haiti-jamaica-cuba.html
ENVIRONMENT,"Rescued tigers, bear get new life in Jordan wildlife refuge",http://www.foxnews.com/world/2016/10/02/rescued-tigers-bear-get-new-life-in-jordan-wildlife-refuge.html
ENVIRONMENT,Wildlife delegates call for end to ivory markets,http://www.foxnews.com/world/2016/10/02/wildlife-delegates-call-for-end-to-ivory-markets.html
ENVIRONMENT,UN wildlife conference bans trade in African grey parrot,http://www.foxnews.com/world/2016/10/02/un-wildlife-conference-bans-trade-in-african-grey-parrot.html
UNITED NATIONS,India set to ratify Paris climate change agreement at UN,http://www.foxnews.com/world/2016/10/02/india-set-to-ratify-paris-climate-change-agreement-at-un.html
THE AMERICAS,"Mexico's Colima volcano erupts, 3 hamlets evacuated",http://www.foxnews.com/world/2016/10/01/mexico-colima-volcano-erupts-3-hamlets-evacuated.html
EUROPE,Albania activists hold protest against waste dumping,http://www.foxnews.com/world/2016/10/01/albania-activists-hold-protest-against-waste-dumping.html
US,"Mega-Hurricane Matthew threatens Jamaica, Haiti, Cuba",http://www.foxnews.com/world/2016/10/01/mega-hurricane-matthew-threatens-jamaica-haiti-cuba.html
EUROPE,Iceland raises aviation alert due to Katla volcano activity,http://www.foxnews.com/world/2016/09/30/iceland-raises-aviation-alert-due-to-katla-volcano-activity.html
THE AMERICAS,9 bodies found in western Mexico,http://www.foxnews.com/world/2016/09/30/bodies-found-in-western-mexico.html
ENVIRONMENT,Gabon gets anti-poaching helicopter from South African group,http://www.foxnews.com/world/2016/09/30/gabon-gets-anti-poaching-helicopter-from-south-african-group.html
ENVIRONMENT,South African rangers kill 3 suspected poachers,http://www.foxnews.com/world/2016/09/30/south-african-rangers-kill-3-suspected-poachers.html
EUROPE,EU nations approve ratification of climate change pact,http://www.foxnews.com/world/2016/09/30/eu-nations-approve-ratification-climate-change-pact.html
ASIA,Anti-wildlife trafficking group lauds Thai ivory crackdown,http://www.foxnews.com/world/2016/09/30/anti-wildlife-trafficking-group-lauds-thai-ivory-crackdown.html
EUROPE,Polish explorer says he found deepest underwater cave,http://www.foxnews.com/world/2016/09/30/polish-explorer-says-found-deepest-underwater-cave.html
THE AMERICAS,British royal kids make rare appearance in Canada,http://www.foxnews.com/world/2016/09/29/british-royal-kids-make-rare-appearance-in-canada.html
ASIA,Thailand suspends seahorse trade amid conservation concerns,http://www.foxnews.com/world/2016/09/29/thailand-suspends-seahorse-trade-amid-conservation-concerns.html
EUROPE,Beijing's latest answer to pollution: the Smog Free Tower,http://www.foxnews.com/world/2016/09/29/beijing-latest-answer-to-pollution-smog-free-tower.html
THE AMERICAS,"In Argentina, freedom still distant for Sandra the orangutan",http://www.foxnews.com/world/2016/09/29/in-argentina-freedom-still-distant-for-sandra-orangutan.html
EUROPE,UN says EU may ratify Paris Agreement soon,http://www.foxnews.com/world/2016/09/28/un-says-eu-may-ratify-paris-agreement-soon.html
ENVIRONMENT,Shark attack survivor campaigns for sharks at UN meeting,http://www.foxnews.com/world/2016/09/28/shark-attack-survivor-campaigns-for-sharks-at-un-meeting.html
EUROPE,"Swiss military helicopter crashes in Alps, injuries presumed",http://www.foxnews.com/world/2016/09/28/swiss-military-helicopter-crashes-in-alps-injuries-presumed.html
ASIA,World wildlife meeting votes to ban trade in Asian pangolins,http://www.foxnews.com/world/2016/09/28/world-wildlife-meeting-votes-to-ban-trade-in-asian-pangolins.html
ASIA,"Massive typhoon hits eastern China, Taiwan, killing 5",http://www.foxnews.com/world/2016/09/28/massive-typhoon-hits-eastern-china-taiwan-killing-5.html
ASIA,Indonesia evacuating tourists after Mount Barujari eruption,http://www.foxnews.com/world/2016/09/28/indonesia-evacuating-tourists-after-mount-barujari-eruption.html
US,Puerto Rico finds unexpected source of growth in agriculture,http://www.foxnews.com/world/2016/09/28/puerto-rico-finds-unexpected-source-growth-in-agriculture.html
THE AMERICAS,Canadian government approves natural gas project,http://www.foxnews.com/world/2016/09/27/canadian-government-approves-natural-gas-project.html
THE AMERICAS,Prosecutor: Woman burned alive for witchcraft in Peru jungle,http://www.foxnews.com/world/2016/09/27/prosecutor-woman-burned-alive-for-witchcraft-in-peru-jungle.html
THE AMERICAS,Global aviation emissions deal in Montreal,http://www.foxnews.com/world/2016/09/27/global-aviation-emissions-deal-in-montreal.html
US,"In 'Deepwater Horizon,' an ecological disaster's human toll",http://www.foxnews.com/world/2016/09/27/in-deepwater-horizon-ecological-disaster-human-toll.html
EUROPE,3 bears revisited: they've got a new home in Kosovo,http://www.foxnews.com/world/2016/09/27/3-bears-revisited-theyve-got-new-home-in-kosovo.html
GLOBAL ECONOMY,Shell: Fire forces closure of key oil pipeline in Nigeria,http://www.foxnews.com/world/2016/09/27/shell-fire-forces-closure-key-oil-pipeline-in-nigeria.html
ASIA,"Overcrowded bus slips off mountain road in Nepal, killing 14",http://www.foxnews.com/world/2016/09/27/overcrowded-bus-slips-off-mountain-road-in-nepal-killing-14.html
ASIA,Strong winds from island-wide typhoon hurt dozens in Taiwan,http://www.foxnews.com/world/2016/09/27/strong-winds-from-island-wide-typhoon-hurt-dozens-in-taiwan.html
ASIA,Vietnamese fishermen sue Taiwan steel firm over fish deaths,http://www.foxnews.com/world/2016/09/27/vietnamese-fishermen-sue-taiwan-steel-firm-over-fish-deaths.html
THE AMERICAS,Driving rain and wind diverts plans for Canadian royal tour,http://www.foxnews.com/world/2016/09/26/driving-rain-and-wind-diverts-plans-for-canadian-royal-tour.html
ENVIRONMENT,AP PHOTOS: These animals are more than meets the eye,http://www.foxnews.com/world/2016/09/26/ap-photos-these-animals-are-more-than-meets-eye.html
ENVIRONMENT,Some elephants learning to avoid dangerous areas: Expert,http://www.foxnews.com/world/2016/09/26/some-elephants-learning-to-avoid-dangerous-areas-expert.html
US,Recent developments surrounding the South China Sea,http://www.foxnews.com/world/2016/09/26/recent-developments-surrounding-south-china-sea.html
ASIA,"Poachers target rare bird's ""ivory"" beak in Southeast Asia",http://www.foxnews.com/world/2016/09/26/poachers-target-rare-bird-ivory-beak-in-southeast-asia.html
PACIFIC,Surfer in stable condition after Australian shark attack,http://www.foxnews.com/world/2016/09/25/surfer-in-stable-condition-after-australian-shark-attack.html
THE AMERICAS,Fuel tanker continues to burn off Mexico's Gulf coast,http://www.foxnews.com/world/2016/09/25/fuel-tanker-continues-to-burn-off-mexico-gulf-coast.html
ASIA,India to ratify Paris Agreement on climate change,http://www.foxnews.com/world/2016/09/25/india-to-ratify-paris-agreement-on-climate-change.html
ENVIRONMENT,Global efforts against ivory traffickers still fall short,http://www.foxnews.com/world/2016/09/24/global-efforts-against-ivory-traffickers-still-fall-short.html
PACIFIC,MH370 wreckage hunter won't give up until mystery solved,http://www.foxnews.com/world/2016/09/23/mh370-wreckage-hunter-wont-give-up-until-mystery-solved.html
EUROPE,North Korean air show highlights new airport as tourism draw,http://www.foxnews.com/world/2016/09/23/north-korean-air-show-highlights-new-airport-as-tourism-draw.html
EUROPE,UN ready to implement climate deal in Morocco,http://www.foxnews.com/world/2016/09/23/un-ready-to-implement-climate-deal-in-morocco.html
ASIA,Laos promises to phase out tiger farms: Conservation groups,http://www.foxnews.com/world/2016/09/23/laos-promises-to-phase-out-tiger-farms-conservation-groups.html
ASIA,Indian court acquits suspects in death of British teenager,http://www.foxnews.com/world/2016/09/23/indian-court-acquits-suspects-in-death-british-teenager.html
EUROPE,Albania passes divisive law on importing garbage,http://www.foxnews.com/world/2016/09/22/albania-passes-divisive-law-on-importing-garbage.html
ENVIRONMENT,"Chainsaws in hand, some de-horn rhinos to stop poaching",http://www.foxnews.com/world/2016/09/22/chainsaws-in-hand-some-de-horn-rhinos-to-stop-poaching.html
EUROPE,EU chief says bloc's credibility at stake over climate pact,http://www.foxnews.com/world/2016/09/22/eu-chief-says-bloc-credibility-at-stake-over-climate-pact.html
EUROPE,Turkish central bank cuts a key rate to boost ailing economy,http://www.foxnews.com/world/2016/09/22/turkish-central-bank-cuts-key-rate-to-boost-ailing-economy.html
US,Argentina: YPF to disclose deal with Chevron on court order,http://www.foxnews.com/world/2016/09/21/argentina-ypf-to-disclose-deal-with-chevron-on-court-order.html
EUROPE,Paris Climate Change agreement passes key threshold,http://www.foxnews.com/world/2016/09/21/paris-climate-change-agreement-passes-key-threshold.html
EUROPE,The Latest: Climate deal tops required 55 ratifications,http://www.foxnews.com/world/2016/09/21/latest-climate-deal-tops-required-55-ratifications.html
EUROPE,World leaders kick off second day at UN General Assembly,http://www.foxnews.com/world/2016/09/21/world-leaders-kick-off-second-day-at-un-general-assembly.html
ENVIRONMENT,Ugandan wildlife dying in national park from drought,http://www.foxnews.com/world/2016/09/21/ugandan-wildlife-dying-in-national-park-from-drought.html
ENVIRONMENT,Africa is divided over ivory trade,http://www.foxnews.com/world/2016/09/21/africa-is-divided-over-ivory-trade.html
ASIA,"19 dead in floods, landslides on Indonesia's Java island",http://www.foxnews.com/world/2016/09/21/1-dead-in-floods-landslides-on-indonesia-java-island.html
EUROPE,Sweden plans green tax credits for home appliance repairs,http://www.foxnews.com/world/2016/09/20/sweden-plans-green-tax-credits-for-home-appliance-repairs.html
EUROPE,"Thousands protest planned trade link-ups with US, Canada",http://www.foxnews.com/world/2016/09/20/thousands-protest-planned-trade-link-ups-with-us-canada.html
EUROPE,The Latest: UN officials say 20 nations to join climate pact,http://www.foxnews.com/world/2016/09/20/latest-un-officials-say-20-nations-to-join-climate-pact.html
EUROPE,Paris deal to receive boost at UN event,http://www.foxnews.com/world/2016/09/20/paris-deal-to-receive-boost-at-un-event.html
ENVIRONMENT,Swiss traders blame governments for dirty fuel in Africa,http://www.foxnews.com/world/2016/09/19/swiss-traders-blame-governments-for-dirty-fuel-in-africa.html
ASIA,2 killed while protesting evictions near Indian rhino park,http://www.foxnews.com/world/2016/09/19/2-killed-while-protesting-evictions-near-indian-rhino-park.html
