category,headline,url
ENVIRONMENT,Rhinos flourish in a South African wildlife park,http://www.foxnews.com/world/2016/02/28/rhinos-flourish-in-south-african-wildlife-park.html
ASIA,SE Asian foreign ministers voice concerns on South China Sea,http://www.foxnews.com/world/2016/02/27/se-asian-foreign-ministers-voice-concerns-on-south-china-sea.html
THE AMERICAS,Brazil: Activists denounce sewage in Rio de Janeiro waters,http://www.foxnews.com/world/2016/02/27/brazil-activists-denounce-sewage-in-rio-de-janeiro-waters.html
EUROPE,"Danish farming, environment minister resigns, crisis averted",http://www.foxnews.com/world/2016/02/27/danish-farming-environment-minister-resigns-crisis-averted.html
PACIFIC,"Ship that ran aground off Antarctica freed, researchers safe",http://www.foxnews.com/world/2016/02/26/ship-that-ran-aground-off-antarctica-freed-researchers-safe.html
US,Mexico documents big rebound in monarch butterflies,http://www.foxnews.com/world/2016/02/26/mexico-documents-big-rebound-in-monarch-butterflies.html
EUROPE,EU to tackle wildlife trafficking helping fund extremists,http://www.foxnews.com/world/2016/02/26/eu-to-tackle-wildlife-trafficking-helping-fund-extremists.html
ASIA,3 British tourists die while climbing waterfalls in Vietnam,http://www.foxnews.com/world/2016/02/26/3-british-tourists-die-while-climbing-waterfalls-in-vietnam.html
ASIA,"Mongolia's livestock in danger after drought, harsh winter",http://www.foxnews.com/world/2016/02/26/mongolia-livestock-in-danger-after-drought-harsh-winter.html
THE AMERICAS,Billionaire Allen to restore Cayman reef damaged by yacht,http://www.foxnews.com/world/2016/02/25/billionaire-allen-to-restore-cayman-reef-damaged-by-yacht.html
EUROPE,Greenpeace targets rich French businessman with protest,http://www.foxnews.com/world/2016/02/25/greenpeace-targets-rich-french-businessman-with-protest.html
ASIA,Cambodian leader threatens log smugglers with rockets,http://www.foxnews.com/world/2016/02/25/cambodian-leader-threatens-log-smugglers-with-rockets.html
EUROPE,Eco protesters avoid prison for blocking Heathrow runway,http://www.foxnews.com/world/2016/02/24/eco-protesters-avoid-prison-for-blocking-heathrow-runway.html
EUROPE,Turkey suspends construction of mine following protests,http://www.foxnews.com/world/2016/02/24/turkey-suspends-construction-mine-following-protests.html
ASIA,Wreckage of missing plane found in Nepal; all 23 aboard dead,http://www.foxnews.com/world/2016/02/24/wreckage-missing-plane-found-in-nepal-all-23-aboard-dead.html
THE AMERICAS,"As drought hammers countryside, many in Haiti go hungry",http://www.foxnews.com/world/2016/02/23/as-drought-hammers-countryside-many-in-haiti-go-hungry.html
THE AMERICAS,Bolivian voters reject letting Morales run for 4th term,http://www.foxnews.com/world/2016/02/23/bolivian-voters-reject-letting-morales-run-for-4th-term.html
THE AMERICAS,Police charge 7 with homicide over dam burst that killed 17,http://www.foxnews.com/world/2016/02/23/police-charge-7-with-homicide-over-dam-burst-that-killed-17.html
ENVIRONMENT,"In South Africa, drones used to battle rhino poaching",http://www.foxnews.com/world/2016/02/23/in-south-africa-drones-used-to-battle-rhino-poaching.html
EUROPE,Czechs protest Polish greenhouse over light pollution,http://www.foxnews.com/world/2016/02/23/czechs-protest-polish-greenhouse-over-light-pollution.html
EUROPE,French president: Pacific nuclear tests impacted environment,http://www.foxnews.com/world/2016/02/23/french-president-pacific-nuclear-tests-impacted-environment.html
US,Report cites new China radars in disputed Spratly Islands,http://www.foxnews.com/world/2016/02/23/report-cites-new-china-radars-in-disputed-spratly-islands.html
ASIA,Damage to India canal highlights Delhi water vulnerability,http://www.foxnews.com/world/2016/02/23/damage-to-india-canal-highlights-delhi-water-vulnerability.html
PACIFIC,A blind penguin gets airborne in a New Zealand marine haven,http://www.foxnews.com/world/2016/02/23/blind-penguin-gets-airborne-in-new-zealand-marine-haven.html
ASIA,Deadly north India protests lead to New Delhi water crisis,http://www.foxnews.com/world/2016/02/21/deadly-north-india-protests-lead-to-new-delhi-water-crisis.html
THE AMERICAS,Anger following dolphin death on Argentine beach,http://www.foxnews.com/world/2016/02/19/anger-following-dolphin-death-on-argentine-beach.html
EUROPE,UN climate chief Figueres to step down in July,http://www.foxnews.com/world/2016/02/19/un-climate-chief-figueres-to-step-down-in-july.html
PACIFIC,Authorities investigate 2 legs left in Australian trash dump,http://www.foxnews.com/world/2016/02/17/authorities-investigate-2-legs-left-in-australian-trash-dump.html
EUROPE,UN chief urges leaders to sign climate agreement on April 22,http://www.foxnews.com/world/2016/02/17/un-chief-urges-leaders-to-sign-climate-agreement-on-april-22.html
EUROPE,Migrants find refuge 'north of the middle of nowhere',http://www.foxnews.com/world/2016/02/17/migrants-find-refuge-north-middle-nowhere.html
ENVIRONMENT,Kuwait Oil Co. announces oil leak at northern well,http://www.foxnews.com/world/2016/02/16/kuwait-oil-co-announces-oil-leak-at-northern-well.html
PACIFIC,Chinese ship to leave Australia to search for Flight 370,http://www.foxnews.com/world/2016/02/16/chinese-ship-to-leave-australia-to-search-for-flight-370.html
EUROPE,VW's European sales show biggest contraction since scandal,http://www.foxnews.com/world/2016/02/16/vw-european-sales-show-biggest-contraction-since-scandal.html
ASIA,Indian Kashmir begins bird census at Himalayan wetlands,http://www.foxnews.com/world/2016/02/16/indian-kashmir-begins-bird-census-at-himalayan-wetlands.html
EUROPE,"Satellite boosts Europe's environmental, border surveillance",http://www.foxnews.com/world/2016/02/16/satellite-boosts-europe-environmental-border-surveillance.html
EUROPE,"Lions, leopards among stuffed animals seized in French home",http://www.foxnews.com/world/2016/02/16/lions-leopards-among-stuffed-animals-seized-in-french-home.html
PACIFIC,Antarctica study: Iceberg nearly erases penguin population,http://www.foxnews.com/world/2016/02/15/antarctica-study-iceberg-nearly-erases-penguin-population.html
RELIGION,Pope celebrates indigenous in Chiapas as Catholics dwindle,http://www.foxnews.com/world/2016/02/14/pope-celebrates-indigenous-in-chiapas-as-catholics-dwindle.html
ENVIRONMENT,"Major ivory network dismantled in Congo, wildlife group says",http://www.foxnews.com/world/2016/02/13/major-ivory-network-dismantled-in-congo-wildlife-group-says.html
EUROPE,Those Valentine's Day flowers might just be from Kenya,http://www.foxnews.com/world/2016/02/12/those-valentine-day-flowers-might-just-be-from-kenya.html
EUROPE,Scandal-hit Volkswagen sees US sales fall 7 pct in January,http://www.foxnews.com/world/2016/02/12/scandal-hit-volkswagen-sees-us-sales-fall-7-pct-in-january.html
ASIA,Coke suspends bottling at plant at center of water dispute,http://www.foxnews.com/world/2016/02/12/coke-suspends-bottling-at-plant-at-center-water-dispute.html
EUROPE,French president names new foreign minister in reshuffle,http://www.foxnews.com/world/2016/02/11/french-president-names-new-foreign-minister-in-reshuffle.html
ASIA,Soldier rescued 6 days after avalanche in Kashmir dies,http://www.foxnews.com/world/2016/02/11/soldier-rescued-6-days-after-avalanche-in-kashmir-dies.html
ASIA,Indian capital to curb cars again to control air pollution,http://www.foxnews.com/world/2016/02/11/indian-capital-to-curb-cars-again-to-control-air-pollution.html
THE AMERICAS,Venezuela malls scale back hours as government cuts energy,http://www.foxnews.com/world/2016/02/10/venezuela-malls-scale-back-hours-as-government-cuts-energy.html
ENVIRONMENT,"Zimbabwe needs $1.5 billion in food aid, says vice president",http://www.foxnews.com/world/2016/02/10/zimbabwe-needs-15-billion-in-food-aid-says-vice-president.html
ASIA,"Elephant rampages in east Indian town, smashing homes",http://www.foxnews.com/world/2016/02/10/elephant-rampages-in-east-indian-town-smashing-homes.html
EUROPE,French authorities in rescue of 7 trapped cave explorers,http://www.foxnews.com/world/2016/02/10/french-authorities-in-rescue-7-trapped-cave-explorers.html
THE AMERICAS,Number of Haitians needing food aid spikes amid drought,http://www.foxnews.com/world/2016/02/09/number-haitians-needing-food-aid-spikes-amid-drought.html
THE AMERICAS,Brazil governor wants environmental fund to pay pensions,http://www.foxnews.com/world/2016/02/09/brazil-governor-wants-environmental-fund-to-pay-pensions.html
ASIA,Man trapped under avalanche pulled out 6 days later,http://www.foxnews.com/world/2016/02/09/man-trapped-under-avalanche-pulled-out-6-days-later.html
EUROPE,Bring on the drones: Mediterranean sees severe overfishing,http://www.foxnews.com/world/2016/02/09/bring-on-drones-mediterranean-sees-severe-overfishing.html
ENVIRONMENT,Tanzania arrests more suspects in slaying of British pilot,http://www.foxnews.com/world/2016/02/08/tanzania-arrests-more-suspects-in-slaying-british-pilot.html
EUROPE,Quality control chief leaves scandal-hit Volkswagen,http://www.foxnews.com/world/2016/02/08/quality-control-chief-leaves-scandal-hit-volkswagen.html
EUROPE,"Storm Imogen lashes Britain with wind, huge waves",http://www.foxnews.com/world/2016/02/08/storm-imogen-lashes-britain-with-wind-huge-waves.html
ASIA,New Year's fireworks a little quieter in Chinese capital,http://www.foxnews.com/world/2016/02/07/new-year-fireworks-little-quieter-in-chinese-capital.html
ENVIRONMENT,5 arrested in killing of British pilot in Tanzania,http://www.foxnews.com/world/2016/02/06/5-arrested-in-killing-british-pilot-in-tanzania.html
EUROPE,"VW postpones earnings release, shareholder meeting",http://www.foxnews.com/world/2016/02/05/vw-postpones-earnings-release-shareholder-meeting.html
ASIA,Photo captures spectacular volcano eruption in Japan,http://www.foxnews.com/world/2016/02/05/photo-captures-spectacular-volcano-eruption-in-japan.html
EUROPE,Albania passes 10-year moratorium to stop cutting wood,http://www.foxnews.com/world/2016/02/05/albania-passes-10-year-moratorium-to-stop-cutting-wood.html
EUROPE,Germany: teenage finder to keep gold bar discovered in lake,http://www.foxnews.com/world/2016/02/04/germany-teenage-finder-to-keep-gold-bar-discovered-in-lake.html
ASIA,Avalanche hits Indian army post on glacier; 10 feared dead,http://www.foxnews.com/world/2016/02/04/avalanche-hits-indian-army-post-on-glacier-10-feared-dead.html
ASIA,New push to move Japan's oldest elephant to sanctuary may be too late,http://www.foxnews.com/world/2016/02/03/move-sought-for-japan-oldest-elephant-may-be-too-late.html
ENVIRONMENT,Morocco unveils massive solar plant,http://www.foxnews.com/world/2016/02/04/morocco-unveils-massive-solar-plant.html
ENVIRONMENT,South African rangers seek to track rhinos in wildlife park,http://www.foxnews.com/world/2016/02/04/south-african-rangers-seek-to-track-rhinos-in-wildlife-park.html
THE AMERICAS,Mexican court rules against development in Cancun mangrove,http://www.foxnews.com/world/2016/02/03/mexican-court-rules-against-development-in-cancun-mangrove.html
ENVIRONMENT,Rockefeller Foundation gives $130M to stem food losses,http://www.foxnews.com/world/2016/02/03/rockefeller-foundation-gives-130m-to-stem-food-losses.html
ASIA,Avalanche traps 10 Indian army soldiers in Kashmir,http://www.foxnews.com/world/2016/02/03/avalanche-traps-10-indian-army-soldiers-in-kashmir.html
EUROPE,Paris police clear sprawling Roma camp at city's edge,http://www.foxnews.com/world/2016/02/03/paris-police-clear-sprawling-roma-camp-at-city-edge.html
EUROPE,Russian tourist loses leg to speedboat in southern Thailand,http://www.foxnews.com/world/2016/02/03/russian-tourist-loses-leg-to-speedboat-in-southern-thailand.html
ENVIRONMENT,"AP PHOTOS: Deep in Israel desert, shimmering glass mountains",http://www.foxnews.com/world/2016/02/03/ap-photos-deep-in-israel-desert-shimmering-glass-mountains.html
EUROPE,Ukrainian border guards stop cigarette-smuggling horses,http://www.foxnews.com/world/2016/02/02/ukrainian-border-guards-stop-cigarette-smuggling-horses.html
US,Swaziland to send 18 elephants to American zoos,http://www.foxnews.com/world/2016/02/02/swaziland-to-send-18-elephants-to-american-zoos.html
THE AMERICAS,Deal protects huge swath of central B.C. coast from logging,http://www.foxnews.com/world/2016/02/01/deal-protects-huge-swath-central-bc-coast-from-logging.html
OUTBREAKS,How to protect yourself from Zika virus,http://www.foxnews.com/health/2016/02/01/how-to-protect-yourself-from-zika-virus.html
ENVIRONMENT,Researchers confirm lion population in remote Ethiopian park,http://www.foxnews.com/world/2016/02/01/researchers-confirm-lion-population-in-remote-ethiopian-park.html
ENVIRONMENT,Bomb attacks on pipelines cause massive oil spill in Nigeria,http://www.foxnews.com/world/2016/02/01/bomb-attacks-on-pipelines-cause-massive-oil-spill-in-nigeria.html
ENVIRONMENT,"Drought hits South Africa's biggest wildlife park, animals at grave risk",http://www.foxnews.com/world/2016/02/01/drought-hits-south-africas-biggest-wildlife-park-animals-at-grave-risk.html
ENVIRONMENT,US pledges $97M to combat Ethiopia's drought,http://www.foxnews.com/world/2016/01/31/us-pledges-7m-to-combat-ethiopia-drought.html
EUROPE,British pilot killed by poachers in Tanzania; 3 arrested,http://www.foxnews.com/world/2016/01/31/british-pilot-killed-by-poachers-in-tanzania-3-arrested.html
PACIFIC,Cyclone may strengthen before landfall in western Australia,http://www.foxnews.com/world/2016/01/30/cyclone-may-strengthen-before-landfall-in-western-australia.html
ENVIRONMENT,"In South Africa, top US official sees poached rhino",http://www.foxnews.com/world/2016/01/29/in-south-africa-top-us-official-sees-poached-rhino.html
PACIFIC,Chinese ship with advanced sonar to search for Flight 370,http://www.foxnews.com/world/2016/01/28/chinese-ship-with-advanced-sonar-to-search-for-flight-370.html
EUROPE,Hungarian court acquits 15 charged in 2010 sludge flood case,http://www.foxnews.com/world/2016/01/28/hungarian-court-acquits-15-charged-in-2010-sludge-flood-case.html
EUROPE,"DiCaprio greets pope in Italian, discusses environment",http://www.foxnews.com/world/2016/01/28/dicaprio-greets-pope-in-italian-discusses-environment.html
EUROPE,"Leaders of Cyprus, Greece, Israel meet to boost cooperation",http://www.foxnews.com/world/2016/01/28/leaders-cyprus-greece-israel-meet-to-boost-cooperation.html
US,Taiwan leader presses claim to South China Sea in isle trip,http://www.foxnews.com/world/2016/01/28/taiwan-leader-presses-claim-to-south-china-sea-in-isle-trip.html
US,Taiwan president visits island in disputed South China Sea,http://www.foxnews.com/world/2016/01/27/taiwan-president-visits-island-in-disputed-south-china-sea.html
US,Grenada man charged with murder in death of US tourist,http://www.foxnews.com/world/2016/01/27/grenada-man-charged-with-murder-in-death-us-tourist.html
EUROPE,UN chief wants clean energy investments doubled by 2020,http://www.foxnews.com/world/2016/01/27/un-chief-wants-clean-energy-investments-doubled-by-2020.html
EUROPE,EU proposes tougher tests for cars amid emissions scandal,http://www.foxnews.com/world/2016/01/27/eu-proposes-tougher-tests-for-cars-amid-emissions-scandal.html
US,"US, China spar over North Korea, South China Sea",http://www.foxnews.com/world/2016/01/27/us-china-spar-over-north-korea-south-china-sea.html
THE AMERICAS,Colombia president calls for probe into hunting of rare bear,http://www.foxnews.com/world/2016/01/26/colombia-president-calls-for-probe-into-hunting-rare-bear.html
THE AMERICAS,US tourist slain on Caribbean island of Grenada,http://www.foxnews.com/world/2016/01/26/us-tourist-slain-on-caribbean-island-grenada.html
EUROPE,Court gives oil disaster captain 2-year suspended sentence,http://www.foxnews.com/world/2016/01/26/court-gives-oil-disaster-captain-2-year-suspended-sentence.html
EUROPE,Eco protesters convicted of blocking Heathrow runway,http://www.foxnews.com/world/2016/01/25/eco-protesters-convicted-blocking-heathrow-runway.html
PACIFIC,Large metal chuck investigated after washing onto Thai beach,http://www.foxnews.com/world/2016/01/24/large-metal-chuck-investigated-after-washing-onto-thai-beach.html
EUROPE,French president in India to strengthen strategic ties,http://www.foxnews.com/world/2016/01/24/french-president-in-india-to-strengthen-strategic-ties.html
THE AMERICAS,Nicaragua: 13 Costa Ricans killed when tourist boat capsizes,http://www.foxnews.com/world/2016/01/23/nicaragua-13-costa-ricans-killed-when-tourist-boat-capsizes.html
EUROPE,Finland to start 2nd govt-sanctioned trial wolf hunt,http://www.foxnews.com/world/2016/01/22/finland-to-start-2nd-govt-sanctioned-trial-wolf-hunt.html
EUROPE,"France, India to focus talks on defense deal, clean energy",http://www.foxnews.com/world/2016/01/22/france-india-to-focus-talks-on-defense-deal-clean-energy.html
ENVIRONMENT,Over 20 killed as Somali forces end siege of restaurant,http://www.foxnews.com/world/2016/01/21/more-than-20-killed-as-somali-forces-end-siege-restaurant.html
THE AMERICAS,Eco-warrior Tompkins' widow to deepen conservation work,http://www.foxnews.com/world/2016/01/21/eco-warrior-tompkins-widow-to-deepen-conservation-work.html
EUROPE,Polish court: lease of Hitler's WWII bunker rightly canceled,http://www.foxnews.com/world/2016/01/21/polish-court-lease-hitler-wwii-bunker-rightly-canceled.html
ENVIRONMENT,South Africa reports small drop in number of killed rhinos,http://www.foxnews.com/world/2016/01/21/south-africa-reports-small-drop-in-number-killed-rhinos.html
ENVIRONMENT,Activists oppose oil drilling around Congo protected area,http://www.foxnews.com/world/2016/01/21/activists-oppose-oil-drilling-around-congo-protected-area.html
ENVIRONMENT,South African court rules in favor of local rhino horn trade,http://www.foxnews.com/world/2016/01/21/south-african-court-rules-in-favor-local-rhino-horn-trade.html
THE AMERICAS,Disappearance of Bolivia's No. 2 lake a harbinger,http://www.foxnews.com/world/2016/01/20/disappearance-bolivia-no-2-lake-harbinger.html
ASIA,Scientists ID new genus of tree frogs long thought extinct,http://www.foxnews.com/world/2016/01/20/scientists-id-new-genus-tree-frogs-long-thought-extinct.html
ENVIRONMENT,Zimbabwe: Rangers in shootout with elephant poachers,http://www.foxnews.com/world/2016/01/20/zimbabwe-rangers-in-shootout-with-elephant-poachers.html
EUROPE,Anxiety in the air as Davos World Economic Forum kicks off,http://www.foxnews.com/world/2016/01/20/anxiety-in-air-as-davos-world-economic-forum-kicks-off.html
EUROPE,The Latest: Oil price drop threatens renewable energy's rise,http://www.foxnews.com/world/2016/01/20/latest-oil-price-drop-threatens-renewable-energy-rise.html
ASIA,Greenpeace: Air in China 10 percent less polluted last year,http://www.foxnews.com/world/2016/01/20/greenpeace-air-in-china-10-percent-less-polluted-last-year.html
ASIA,Coconut trees are no longer considered trees in Indian state,http://www.foxnews.com/world/2016/01/20/coconut-trees-are-no-longer-considered-trees-in-indian-state.html
EUROPE,VW names new North America chief following emissions scandal,http://www.foxnews.com/world/2016/01/19/vw-names-new-north-america-chief-following-emissions-scandal.html
ENVIRONMENT,DiCaprio rips Big Oil at Davos confab of business leaders,http://www.foxnews.com/world/2016/01/19/dicaprio-rips-big-oil-at-davos-confab-business-leaders.html
US,Secretary of Interior: US supports sustainable trophy hunts,http://www.foxnews.com/world/2016/01/19/secretary-interior-us-supports-sustainable-trophy-hunts.html
EUROPE,"Renault recalls 15,000 cars for emissions fixes, France says",http://www.foxnews.com/world/2016/01/19/renault-recalls-15000-cars-for-emissions-fixes-france-says.html
US,"Deep in Colombian jungle, peace looms at rebel hideout",http://www.foxnews.com/world/2016/01/18/deep-in-colombian-jungle-peace-looms-at-rebel-hideout.html
EUROPE,Avalanche kills 5 soldiers during French Alps training,http://www.foxnews.com/world/2016/01/18/avalanche-kills-5-soldiers-during-french-alps-training.html
PACIFIC,All 60 aboard New Zealand tourist boat rescued from fire,http://www.foxnews.com/world/2016/01/18/all-60-aboard-new-zealand-tourist-boat-rescued-from-fire.html
ASIA,AP PHOTOS: Rescuing Borneo's threatened orangutans,http://www.foxnews.com/world/2016/01/18/ap-photos-rescuing-borneo-threatened-orangutans.html
THE AMERICAS,"Crowds attack Mexico pipelines, steal diesel with buckets",http://www.foxnews.com/world/2016/01/15/crowds-attack-mexico-pipelines-steal-diesel-with-buckets.html
ASIA,"Bus falls into gorge in Indian-held Kashmir, killing 11",http://www.foxnews.com/world/2016/01/15/bus-falls-into-gorge-in-indian-held-kashmir-killing-11.html
EUROPE,Only VW fails to cash in on rising European car sales,http://www.foxnews.com/world/2016/01/15/only-vw-fails-to-cash-in-on-rising-european-car-sales.html
ENVIRONMENT,South African ranger killed in case of 'friendly fire',http://www.foxnews.com/world/2016/01/15/south-african-ranger-killed-in-case-friendly-fire.html
EUROPE,Egypt to spend $32M upgrading tourist resort security,http://www.foxnews.com/world/2016/01/14/egypt-to-spend-32m-upgrading-tourist-resort-security.html
ASIA,Global stocks take battering but Wall Street set for relief,http://www.foxnews.com/world/2016/01/14/global-stocks-take-battering-but-wall-street-set-for-relief.html
EUROPE,Renault shares tank after anti-fraud raids,http://www.foxnews.com/world/2016/01/14/renault-shares-tank-after-anti-fraud-raids.html
EUROPE,"Ahead of Davos, climate change tops list of economic risks",http://www.foxnews.com/world/2016/01/14/ahead-davos-climate-change-tops-list-economic-risks.html
EUROPE,Alps avalanche: Students may have skied ahead of teacher,http://www.foxnews.com/world/2016/01/14/alps-avalanche-students-may-have-skied-ahead-teacher.html
ASIA,Conservationists welcome Hong Kong move to ban ivory trade,http://www.foxnews.com/world/2016/01/14/conservationists-welcome-hong-kong-move-to-ban-ivory-trade.html
US,US seeks details on drowning of American in India,http://www.foxnews.com/world/2016/01/14/us-seeks-details-on-drowning-american-in-india.html
EUROPE,The Latest: Fresh blast near Starbucks in Jakarta,http://www.foxnews.com/world/2016/01/14/latest-fresh-blast-near-starbucks-in-jakarta.html
EUROPE,"Avalanche in French Alps hits high school ski group, kills 1",http://www.foxnews.com/world/2016/01/13/avalanche-in-french-alps-hits-high-school-ski-group-kills-1.html
EUROPE,Avalanche hits school group in French Alps,http://www.foxnews.com/world/2016/01/13/avalanche-hits-school-group-in-french-alps.html
PACIFIC,Woman in stable condition after Australian crocodile attack,http://www.foxnews.com/world/2016/01/13/woman-in-stable-condition-after-australian-crocodile-attack.html
PACIFIC,Ocean search for Malaysian airliner finds 2nd shipwreck,http://www.foxnews.com/world/2016/01/13/ocean-search-for-malaysian-airliner-finds-2nd-shipwreck.html
ASIA,Vietnam dismisses China's accounts of test flights,http://www.foxnews.com/world/2016/01/12/vietnam-dismisses-china-accounts-test-flights.html
EUROPE,"Benigni on Pope Francis: A fountain, waterfall of mercy",http://www.foxnews.com/world/2016/01/12/benigni-on-pope-francis-fountain-waterfall-mercy.html
EUROPE,"Canada mining company halts some works, cuts jobs in Greece",http://www.foxnews.com/world/2016/01/12/canada-mining-company-halts-some-works-cuts-jobs-in-greece.html
THE AMERICAS,20 dead in southern Mexico bus crash,http://www.foxnews.com/world/2016/01/10/20-dead-in-southern-mexico-bus-crash.html
ENVIRONMENT,"South Africa heat wave claims 11 lives, say officials",http://www.foxnews.com/world/2016/01/10/south-africa-heat-wave-claims-11-lives-say-officials.html
ENVIRONMENT,Mozambique park sees wildlife numbers grow in wake of war,http://www.foxnews.com/world/2016/01/09/mozambique-park-sees-wildlife-numbers-grow-in-wake-war.html
EUROPE,Scandal-hit Volkswagen brand sees 2015 sales fall 4.8 pct,http://www.foxnews.com/world/2016/01/08/scandal-hit-volkswagen-brand-sees-2015-sales-fall-48-pct.html
THE AMERICAS,Young socialist hardliner will lead Venezuela's economy,http://www.foxnews.com/world/2016/01/07/young-socialist-hardliner-will-lead-venezuela-economy.html
ASIA,China lands large civilian aircraft on disputed island in South China Sea,http://www.foxnews.com/world/2016/01/07/china-lands-large-civilian-aircraft-on-disputed-island-in-south-china-sea.html
ASIA,Malaysia to ban bauxite mining in Pahang for 3 months,http://www.foxnews.com/world/2016/01/06/malaysia-to-ban-bauxite-mining-in-pahang-for-3-months.html
ENVIRONMENT,Shares in Volkswagen slide after the US Justice Department sued the German automaker,http://www.foxnews.com/world/2016/01/05/shares-in-volkswagen-slide-after-us-justice-department-sued-german-automaker.html
ENVIRONMENT,"Guatemala's Volcano of Fire spews fiery material, huge ash columns; no immediate evacuations",http://www.foxnews.com/world/2016/01/04/guatemala-volcano-fire-spews-fiery-material-huge-ash-columns-no-immediate.html
ENVIRONMENT,Insurer: 2015 saw lowest natural disaster losses in 6 years as El Nino curbed Atlantic storms,http://www.foxnews.com/world/2016/01/04/insurer-2015-saw-lowest-natural-disaster-losses-in-6-years-as-el-nino-curbed.html
ENVIRONMENT,2 Lithuanian climbers killed in French Alps avalanche; authorities warn of continued risk,http://www.foxnews.com/world/2016/01/03/2-lithuanian-climbers-killed-in-french-alps-avalanche-authorities-warn.html
ENVIRONMENT,South African group says rhino poaching down slightly in 2015; others say picture still dire,http://www.foxnews.com/world/2016/01/02/south-african-group-says-rhino-poaching-down-slightly-in-2015-others-say.html
ENVIRONMENT,Indian capital starts limiting cars for 2 weeks to clear air,http://www.foxnews.com/world/2016/01/01/indian-capital-starts-limiting-cars-for-2-weeks-to-clear-air.html
